review,rating,date
"To be quite honest, I was a skeptical at first. I have just had so many other issues with previous banks and accounts. Hidden fees, etc. that I decided to take a chance. Chime is actually one of the best decisions I ever made. It’s helped me raise my credit with the credit builder card, actually save money with the percentages it moves to your savings with every deposit and charge to the account. The referral bonus is amazing! Who doesn’t like free money, am I right? My direct deposit has no issues, and most convenient stores, Walgreens, etc, and Walmart do deposits so it’s honestly better than having to take a separate trip to a bank when you can go to Walmart or somewhere else and do your deposits and do your shopping all in the same beat if you have a hectic work schedule like I do. Chime is great, through and through and I will continue to refer people and use it myself for years to come!",5,2023-10-13 21:16:39
"The bank is fine, they have most modern online banking features and an ok APY for savings. The app works well. My problem is that I opened the chime credit card, and started using it for most things, as recommended by chime. It raised my score 13 points after a couple months, which seemed great. However, it then lowered my score by 20. The reason given is that my chime/ stride credit balance had increased. It’s showing that I “owe” money, even though it says in the app that chime does not report usage, only on- time payments. There is no option to make it just pay the entire “balance”, instead it apparently only pays a small portion of the money you load each month. Makes no sense to me. Searching online, this happens to others frequently. A chime staff response on the Reddit thread regarding this issue was terrible and explained nothing. I stopped using the credit card, and would recommend researching more than I did before opening a chime account. There are a lot of people that say chime is great for them, and that’s awesome, but my experience has been poor.",2,2024-04-30 02:37:52
"So I had Arvest and Chime for many years until last year in early 2021 I got rid of my Arvest account and now solely use Chime. I cannot recommend this enough. NO FEES! That’s what got me. Even if you cannot let go of your original bank (like myself years ago) this is a fantastic secondary option. I am a Dasher for DoorDash and originally used this for that and paying bills. Cashing out at the end of my shift and having my money show up in my chime account within 2 seconds is the best. Also, getting paid up to 3 days early is legit. I’m paid fridays and mostly get paid Wednesday to Thursday. And even received my child tax credit earlier than some friends of mine. Also the boosting you can send to friends and have them send to you for your Spot Me balance comes in handy when you need it. This app and bank gets a 10/10 from me and this is year 5 for me. I also recently ordered my card for my credit builder. Definitely recommend.",5,2022-01-07 19:17:47
"I signed up years ago to get a tax refund direct deposit.. but I ended up not even using it. I got card in mail and had it in safe for years. I started seeing more commercials and hearing my friends rave about Chime. Plus my “regular” bank was charging me tons of fees for the stupidest stuff. That is when I switched my direct deposit to Chime and haven’t looked back since. No fees people! Plus the spot me is awesome with no overdraft or overdrawn fees or whatever the big box banks called them. In addition to the spot me they loan out an extra $500 until payday. At first it was just $250 then it went up to $500. So then when your direct deposit comes in that amount just gets deducted. Chime truly is the next best thing to sliced bread… I have converted so many people. (which usually you will get $100 for each new member- but I didn’t do the referral, ppl are extra careful when it comes to their money)
If you are not sure, just try it.",5,2024-09-22 21:42:20
"I decided to try chime out for direct deposit a couple of days ago. I had a paycheck direct deposited the next day, and realized I could not get it out because I have no card. I read on their app that transfers to other chime members are free and instant. I was also told the same thing by an employee on the phone. I tried to do the transfer on the app and It wouldn’t allow me bei had not activated my card. Fine. A customer service member told me I can still do the transfer, my friend and I each have to send an email with our photo ID and other pertinent information. We both sent the emails and waited an hour before I called again to see what was going on. They told me the people in that department seem to have gotten the emails but he said he would put a rush on the case. It has now been 6 hours and I haven’t heard a peep from chime. If you need money ASAP do NOT rely on this app to get it to you. I’ve been told that netspend is much quicker and has an excellent overdraft protection program. If the money comes tomorrow I may update this review. If it doesn’t I’m pulling all my money out as soon as I get a card and closing the account. Do not advertise things that aren’t true instant is not a 24 hour wait.",1,2020-02-08 22:56:07
"Great bank for an online bank. Overdraft all that great helps out a lot. My pay is terrible. If you find yourself in a bind do not use it no better than a payday loan they randomly change it every paycheck giving you higher limits to borrow money and then without warning will change it $100 or more and screw you out of that money well thought out on there because it benefits them but screw you over because if you’re someone like me in my shoes that struggling it does nothing but hurt your ability to climb out of it and they keep you in trapped and even though you have $160 credit limit, they will only give you a couple dollars every day that you can withdraw from that after taking half of your check, yes it can be useful. If you’re trying to learn how to manage your money but by them taking that is hurting you more because now you can’t get the things done that you need to get done because they are withholding the money that they offer until they feel, like they want to give it to you do not use my pay",3,2024-11-22 23:41:14
"I have no complaints about the app itself, but dealing with customer service is an absolute nightmare! After ordering a credit builder card, I never received it in the mail, so I sent an email to customer service describing the problem. They replied that they had canceled my DEBIT card and would send a replacement. I got back in touch and another agent assured me that both new cards were on the way. That was over a month ago. I have since contacted support yet again and received the same canned/scripted response. Confirm your address, we’ll send new card, blah blah blah. These “agents” are either bots or people who don’t understand English, because I get nothing but the same repetitive answers and silly platitudes. But where are my cards?  (An unrelated issue, but why bother asking for a preferred name on my profile, when the customer service “agents” insist on constantly and creepily addressing me by the legal name on the card?) 🙁",5,2023-06-05 15:32:50
"I’ve had Chime for over a year now, almost a year and a half, and they have been such a delight to work with. Now, my banking needs are rather simple - direct deposits a couple of times a month from work, credit card payments, and my balances are truthfully not very high. Nothing is too complicated, and so this bank and app is perfect for my simple needs. The app is so intuitive, I’ve never had to directly reach out to customer support because it’s so easy to do anything. Someone stole my card info, and I could just go in the app, cancel my card, and get a new one. The thing that initially grabbed my attention for Chime was the high interest savings account. My old bank’s APY was 0.01%. and while initially nervous about the switch to an online-only bank, again, I’ve had less issues with Chime than I had with my previous, nationwide bank with hundreds of in person branches. Highly recommend switching!",5,2022-10-10 20:22:32
"🌈HAPPY ENDING FIRST🌈: Chime is AMAZING. They really have no fees, I can use BOA ATMs, I adore they’re frequent text alerts with purchases and your balance. You can’t overdraw (other than their complimentary “Spot Me” program). 
😰THE NIGHTMARE😰: After over 20 years with Bank of America, after thousands of dollars in check fees “monthly maintenance” fees, over draft frees, deception, frustration... I saw s Chime commercial and thought “What do I have to lose?” I had just come from a BOA location begging them to help me reverse 7 - $35 overdraft fees that were not my fault. I had been laid off my last paycheck was mailed not direct deposited; I deposited the check as soon as I realized just a few days after the fact. Something I’d never done, an honest mistake. I was sobbing. I was scared. On top of being without an income, I was $250 in the hole. I was I was a loyal customer for 23 years. She told me no. I was done. 
💚CHIME IS THE FUTURE OF BANKING💚 I’ve told all of my friends and family; this is the way to go. Thanks Chime, 
Jennifer Fenton",5,2020-03-28 02:44:07
"Many times I would give 5 stars but at times recently I’ve had problems using it at POC terminals when I don’t have my card & try using my phone. Recently purchases I’ve always made at 7/11 were denied as not valid items. Plus only place I can make a free deposit is too far to walk. I am really glad that Chime gave me back my emergency overdraft fund. It was gone for a period when I lost job & direct deposit. But I have transfers I can make from other bank. Unfortunately, Apple Pay is not compatible with an instant transfer. So I keep money I immediately need as Apple Cash & transfer rest to bank. If before 9AM EST then usually arrives in account by 5PM EST. Thanks Chime it is a way to transfer money to me my 80 year old Mother understands. We’ve already stopped Venmo & PayPal too confusing for her. She understands Apple Cash. 🤣Plus when my nephew in another state was raising Toys For 
Tots money I was able to send to his phone number even though he’s not on Chime & I was unwilling to do Venmo. 🙏❤️😃",4,2024-03-25 23:25:10
"This was seriously the best banking experience ever. Ever. Had all my peeps sign up. They loved it. All of us needed to cash US treasury checks. Absolutely dreamy. Practically instant. Until one day, my fiancé went to his app to cash his long awaited refund check from the irs, and he can’t. No mobile deposits unless you have direct deposit. What?!? I cashed 3 checks from the irs. My app gives me the option of mobile check deposit and asks which kind of check it is. His doesn’t even give him the option. Just leads him to sign up for direct deposit. We called customer service, the girl had no answer. No reason why. Even suggested we do some self pay from another account like it’s a direct deposit WHICH IS ACTUALLY NOT ALLOWED AND STATES IT IN YOUR RULES so why this rep even suggested it also just whoa. Really bad. So yeah. Why. Why’d you have to ruin my favorite app ever. With the little funny emojis every day telling me my balance. Also, why the days and days waiting for a transfer from my big bank? Cash app it’s available immediately. You guys, a week. Boo!",3,2021-09-07 06:53:23
"I wanted to try Chime because I use eBay a lot and eBay just ended their contract with PayPal. I tried signing up for a Chime account, and my request was immediately declined saying that their services team wasn’t able to provide me with any information as to why. I decided to contact Chime via email explaining the situation and they basically told me the same thing, “the information your provided isn’t verifiable therefore you cannot open an account with Chime at this time”. Nothing about my informations should be unverifiable... I offered to send them a picture of my license or another form of verification and they just sent me the same automated response basically saying that they would refuse to offer me an account because their system isn’t able to verify the info I provided.
Thanks a lot Chime. Here’s a suggestion: if you have people trying to use your app and are willing to provide other forms of verification, enter it MANUALLY. Relying on an automated website to approve or decline information will clearly have its issues, and the fact that you’re not willing to even try to work around those issues when they arise is frustrating. That’s not how you run a company.",1,2021-03-02 20:49:51
"When I first became a Chime member. When I used the overdraft amount, and then the following month it got repaid and it used to ask to leave a tip. The tip was half the amount than it is now. I try to tip when I am able to but since I can’t spare to tip. Don’t get me wrong I am very grateful and appreciate the overdraft option it’s awesome! 
But now the lowest tip amount is twice then what it used to be. I’m in a bankruptcy right now and I am half way through it and money is so tight. The courts barely leave me enough money too live on. I don’t appreciate the tactics chime is using now. 
Chime says tipping is not required and that is how it keeps a no fee overdraft fee but if I don’t tip to keep it free I need to tip otherwise chime is going to have to start charging a fee. The other thing is that I should be the one to tip an amount I can afford not a preset amount. I would be able to tip  what I could afford then. 
I appreciate Chime and the awesome services they offer and provide but I feel very bad that I am not able to tip and show my appreciation sometimes. 
Thank you.",3,2023-10-04 21:07:13
"Terrible customer service. Their app/website is useless. I requested a new debit card on June 3rd through their app (which is how you’re supposed to do it) and on June 16th after reaching out to customer service again, I was informed that the new card request never went through. So now nearly 3 weeks later, I am still unable to access my funds because my old card is “compromised” and the new one hasn’t arrived yet. My only option is to transfer the money to another bank account (which still isn’t instant). This app/bank isn’t really worth the trouble.

1/9/18 Update: After having my card replaced THREE TIMES because of attempted fraudulent charges and not even using the account, today I got yet another notification that someone was attempting to use my card to spend $45 at Pizza Hut. I’m not sure how anyone could have gotten my card information because the card never left my house after it was delivered and activated. 

Do not use this service. Their customer service is awful and does nothing to solve your problems. If you’re looking for an online bank, I recommend trying one of the many others that are out there. Getting paid two days earlier is NOT worth the stress.",1,2019-01-09 21:51:26
"Chime is a life saver! I’m so appreciative for them. They have been nothing but help these last few years. They have helped build my credit, helped with money management and so many other things. Chime is so resourceful and have many tools that’ll help you in real life. Honestly, you’re a fool if you don’t have Chime. The best online banking out there. Their only con used to be that they don’t have a physical bank that you can walk in. Now they even nipped that in the bud by allowing you to deposit your money at places like Walgreens for free. They even let you know what free atms are in your area so that you can withdraw without an issue. I seriously feel like Chime was made with me in mind and for that I’m forever loyal. If I had the opportunity I would do business with Chime on some partnership type stuff or maybe even just be endorsed by them. They’re that good and I hope they stick around for the long hall.",5,2024-10-05 21:17:36
I’ve had chime for a few years now. So far the problems I’ve had have been easily fixed with their 24/7 support team. The app has a bot that helps you but if you need an actual person talk you have to do is ask and you can message them or they can call you. Their atm’s are all over the place and moving money from one bank to another isn’t hard at all. I’ve never been charged for a card I’ve lost and it’s always been between 3-5 business days that I have received it. Within that time you can use the temporary card on your phone to pay for your goods. When you get a direct deposit you can go up to $200 in the negatives and never be charged a fee. Lastly my credit has shot up since I’ve used their credit builder card that you use your own money like a debit card and it builds your credit with. I highly recommend chime and hope you enjoy it like I do!,5,2023-09-10 17:06:33
"I set up my debit card to this account to make a transfer into my bank instead but it will NOT allow me to whatsoever. Sure, it accepts my card with my bank but no transfer is allowed so I can’t do that to get my money out. In fact that was what I was trying to do because when I went to the store this morning I wasn’t able to pay with my virtual card- because it never had me set up a pin and there’s no option to add one- and stores require a pin for purchase. It was working fine a day ago, but now it doesn’t and I can’t pull money out of the account or use the card- I can’t access my money at all. I’ve never had this much of an issue with a banking app before. I’ve been going through circles this morning with this app just trying to get my money out so I can pay for gas of all things. There are plenty of other banking apps that work much easier and BETTER, i highly recommend going with another banking app so you don’t have to go through circles trying to pay for gas or whatever else you need or just trying to get access to your money in general.",1,2024-08-11 12:44:25
"Since the very beginning this bank has offered me unlimited amounts of opportunities. Because of this bank I have been able to survive through it ALL, literally. I’ve grown so much financially with the help of Chime. I’ve learned how to manage my money more than I’ve ever thought. It may seem a bit crazy because it’s not the first bank that comes in mind, but I kid you not, Chime is going in the right direction!! The masterminds behind the scenes really have the right idea and from what I’ve experienced so far, I can tell that they do it all genuinely and with all of the right intentions. I have a couple of other bank accounts for obligated reasons, but this is my main account and I do not plan on changing that any time soon! Thanks for always having my back Chime, from the notifications on account activity to the surprise deposits when it is most needed! My family and I truly appreciate the love. XO - Michelle",5,2022-03-19 05:36:18
"This is the best bank I have ever had! Ok, so first off there’s no hidden fees, there’s nothing like maintenance fee, overdraft fee, or anything like that. The bank let’s you get your paycheck TWO days early! If you do overdraft, they have this feature called SpotMe, where they can spot you a certain amount of money before your card gets declined. There’s a saving account here too and it can take part of your paycheck for you towards your savings automatically! The bad thing is, if you wanna deposit money here it’s hard, you have to pay 4.99 to deposit money and you have to go to places like CVS. Also, I think it’s like 4.99$ every 100$, but I don’t deal with cash that much, so it doesn’t affect me. It has mobile deposit too and you can link your other bank to this bank too. Check wise they will mail a check out for you (I wish they would give us a checkbook tbh). Overall, I’m really in love with this bank! I’m never going back to my old one (Ew BoA)!",5,2020-03-20 08:26:41
"I started using this banking because of an issue with my other bank of 25+ years. I really love Chime except there was one major flaw in the system. If your phone breaks your screwed. I had like about $100 in my checking and about $200 in my savings and then my phone broke and I was without a phone for over 2 weeks. Well in order to pay for my replacement phone I was going to need to transfer the $200 from my savings to my checking, so I went onto my laptop to open it there but I had never used it on my laptop before or anywhere except my phone. In order to verify my identity they only have it available to do that with your phone! Yup that’s right broken phone equals no verification. When I called the bank to get them to transfer the money they couldn’t do that at all. So they had to close my savings account so the money would then transfer automatically to my checking. So if you get Chime make sure that you open it up on more than one device. Oh and the customer service was like talking to a 13 year old.",3,2021-03-14 03:59:53
"Expressing my thoughts to Chime is paramount, given the exceptional experience I’ve had with their customer service representatives. They have truly excelled in providing assistance, surpassing even their own high standards. The level of support I received was not just excellent but truly extraordinary. From the moment I reached out for help, their representative exhibited unparalleled professionalism, patience, and expertise, guiding me through every step of the process with care and precision.

Their commitment to customer satisfaction is commendable and deeply appreciated. It’s evident that Chime takes great pride in ensuring that their customers receive the best possible service. The dedication and attention to detail demonstrated by their team are nothing short of remarkable.

As I reflect on the experience, it’s difficult for me to imagine how Chime could possibly improve on their already exceptional work. Their service was not only efficient but also delivered with a genuine sense of care and empathy. It’s clear that each interaction is handled with the utmost importance, leaving customers like myself thoroughly impressed and grateful.

In summary, I want to extend my sincerest gratitude to Chime for the outstanding support they provided. Their customer service representative truly went above and beyond to assist me, and for that, I am truly thankful. Hats off to Chime for their exemplary work and unwavering commitment to customer satisfaction!",5,2024-05-11 07:19:36
Don’t trust them w/ your money. They are not insured like Zelle and others. They pretend to be but they can’t back up their service. Even w/ my bank & routing number they said even though my transfer funds happened on a Wednesday night that my $50 would not be available until the following Monday. I called to just have it canceled the next day bc I was being issued a new bank debit card so I had a limited access to my funds and NEEDED that money and couldn’t wait their ridiculous amount of time. I pleaded for them to do something and he told me ‘too bad so sorry’ in a think India accent. I instructed them if they couldn’t offer any kind of help to just close my account. I called my bank and they honored the amount to me even while it was still being processed had not finished. They have the worst service and work ethics I’ve have ever had the pain to deal with and regret signing up and getting my friends/family yo join as well. They are all cancelled their accounts as well bc of this and I suggest you all do the same if you made the same mistake I did by joining this mucky mouse pathetic app that doesn’t care about their customers.,1,2025-03-08 02:08:33
"I used to bank at Wells Fargo which is a good bank too but nothing like Chime my Deposits hit a day before in the afternoon as opposed to around midnight the day of, however, the real reason they get 5 stars is their customer service and no fee way of operating. I’ve had two issues of having a membership that I had cancelled charged. Through the app without having to call they fix the problem return, what was charged, and stop them from charging again as well as replace your debit card if it’s been compromised all within a day or two of submitting your concerns. They also provide you with an instant debit card you can access through the app and add to your mobile pay to continue using your account while your new card arrives. Don’t even get me started with their Spot Me and safe credit building services. They actually care about the individual not just their cash.",5,2021-11-01 19:27:15
"With the Chime banking system everything you do with your money is simplified. Keeping track of your balance is easier than it has ever been. Maintaining a budget is more of a reality now with the instant feed back of your transactions. Sending money to pay bills or friends is quick and just a touch away. Having no paper trail is very important to me because I am a believer in doing what I can to help save the environment. Costumer service is always available to assist you with any problem that occurs 24 hours a day which is convenient to everyone in today’s world. Add money to your account can be done in a variety way. One or of which will suit your needs to the  T. I’m positive you, no matter what your style or preference is, will benefit today, tomorrow, or in the future from opening an account with Chime. Have a wonderful day. Please be safe out there in the world, and thanks for checking out my review. You’ll love this way of banking as much as I do.",5,2020-10-17 17:37:53
