review,rating,date
"I turned 18 recently and in an effort to become an adult I decided to go with Chime to help build my credit. The sign up process was incredibly easy and seemed legit, I ended up getting a card and getting access to my account. After a couple of days, I went to the app to transfer money and found that I was not able to log in because my account no longer existed. At first I thought I just dreamed signing up for the app, but that’s ridiculous because I had the card. I ended up calling support and the lady I talked to informed me that my account was suspended. I had no money in the account and I only had it for a couple of days, in order to lift the suspension I had to send my ID and proof of insurance which would be all fine and dandy if I hadn’t already put my ID in the app and felt like it was a little sketchy. She said that my account violated a term of their bank but I hadn’t violated any terms and I wasn’t even able to close the account because she wasn’t able to do that for whatever reason. Absolutely upset that now some company that had been recommended to be had screwed me over and took my information, thank god none of my money, but after looking it up I found a lot of people have had this problem. 
100% do not recommend and if you do have it, look into Chime closing accounts for no reason and close your account. Put your money somewhere else.",1,2021-12-11 20:00:11
"I’ve been using Chime for a couple of years. I just don’t go into a bank anymore. The only reason why I am going to open up a separate account with a brick and mortar is because in the next few years I want to get a decent home loan and usually being a member of the bank will help with that. Other than that this is perfect especially for people that aren’t ready to make a major purchase yet. I have had issues in the past and they have been resolved quickly and customer support is quick to ask. For those that are having issues with the chatbot, you can just type “human” and you can submit something to them and they usually get back to me within less than 12 hours probably about four. There have been times where the system has been down. This is why I’m removing a star. The system has been down several times in the past year by several I mean like maybe three but that’s still too many times. I have a credit card as back up. Working in IT myself I can’t actually be too upset. Things happen. I am prepared.
I would not recommend this for somebody that is old-school but if you never really go into your bank or use checks anymore… (You CAN send a check from the app and it is mailed) this is for you.",4,2020-12-17 19:57:23
"I’ve loved and raved about my chime service. I thought it was great and worked perfectly for me and my lifestyle as I am a student.  But, I had somebody hack into my card more than once, totally understandable, it happens with banks. The first time took over a year to resolve for $99… I wouldn’t fight for that amount of money if I didn’t need it. However, both times it has happened Chime has made it close to impossible to get my money back for charges that that I did not spend or authorize. Last time this happened it was for 3 charges at one time for over $1,000 at Walmart? If I was spending that kind of money myself why would I have 3 different charges increasing in value each time knowing I didn’t have that money? And when I reported it, Chime told me they didn’t see anything suspicious. Thank god my account balance didn’t have sufficient funds for all of the charges to go through or else I would literally be homeless. I work hard for my money and it’s absolutely ridiculous that a bank will let people get away with spending something I worked for leaving me unable to pay for my own bills. I’ve had banks ask me for less information and have given me my money back no questions asked. 
Don’t leave a large amount of money in your chime account because god forbid somebody gets ahold of your information, your screwed if it’s up to Chime.",1,2022-10-07 12:25:43
"I couldn’t say enough good things about being with chime. It’s been years now and I’ve never had a single issue or annoyance with anything at all. It is so easy and there is no catch or hidden agendas here. No fees or monthly costs. The feature Spot-me has my back frequently, it’s saved me many times.. you don’t overdraft your account ever, if you have spot me, you just pay it back when you can. You won’t get that anywhere else!!!!!!!! It’s very user friendly and everything works as it should. I love not having an actual bank I have to walk into, I can do everything I need to do with this account, I started with the debit card and got my credit builder with my qualifying direct deposit and my credit score went up almost 50 points!!!! It is still a debit card- you just put money in the account, but it does track things somehow- I get paid 2 days early every single paycheck by about 12 PM and some is automatically distributed into my savings. Chime is AMAZING!!!!!!!
I recommend it to all my friends and anyone reading this! I only regret I didn’t do it sooner. Thank you chime!",5,2024-10-06 07:26:47
"Chime promotes that it’s the easiest way to bank. They however are not a bank. They collect your information as they are a financial technology company. 
Chime states you have a limit of CREDIT transactions of 10,000 per day. But you have no option to use the card as a credit card. They only send you one card( as any bank would)however, using it as credit is not an option. 
If you send a check to someone ( as they advertise they can pay anyone fast and free) it takes a month before the person even receives it. They have no options for cashier check/ money order and make it extremely difficult to withdraw or transfer money regardless of what they advertise.
 I called customer service trying to understand why I couldn’t use my card to charge a cleaning company that provided me service with the 10,000 credit limit allowed.
 (services were 2,000) I had the money in my account. I hadn’t went over any “ limits “ that day. Only to talk to someone who can’t speak English and couldn’t answer my question. All she had to say is that I don’t have the credit card I have the debit card… another card was not offered or mentioned. Nor does it say when you sign up that you will need to apply separately for a credit card. I am switching everything to another account and will not be using Chime again.",1,2024-03-18 21:43:05
"A 4.8 who makes these scores. This is by far the worst prepaid card out today. They will blitz you with marketing telling you about the $200 overdraft. The real story is they give you $20. Then they tell you to spend money like Chime wants to get the $209. They don’t really want to give it to you or they wouldn’t only make it available to people who have proven they don’t need it. When you call customer service it is very difficult to understand the person on the other end. The accents are so thick it isn’t really English they are speaking. They also have no authority and given no discretion to make a decision. Chime doesn’t really trust them. It is just cheap labor. I was at Wells Fargo were I could get up to $600 overdraft if I needed it. Chime called 3 times a week and mailed me things more often to switch over. They always mention the $200 overdraft, but never once mention how hard it is to get. That should be illegal. Tonight my card was used without my permission. They want me to wait 5 days to get it back. That is not protecting my identity or treating me like a valuable customer. It is me having to prove my innocence to a company I let control my money. Stay away from this app. It is all lies. The spot me marketing is a scam. If you are struggling at all you will never get passed the $20 spot me limit. Changing to Chime has been one of the worst decisions I could make",1,2024-03-07 06:57:23
"Chime has some nice features but I don’t see myself using this account for very much because it’s such a hassle to log into, or get customer service from. For example, I called them because someone hacked my account and it took them nearly an hour just to correct my phone number on my account. During that time I was switched to talk with 5 different people (all with heavy accents and hard to understand) and then I had to send them a picture of my drivers license along with a selfie. Again, this was all just to change my phone number. In fact, every time you try to log into your account you not only have to use your password but you are forced to solve 3 to 5 different “puzzles”. If you answer any one of those puzzles wrong, well, then you are forced to start the entire process all over again from the start! Then after that circus they send you another authentication number to your phone which you have to send back to them. This means you’re forced to have your phone on you whenever you log in, even if you’re using an iPad or computer to log in. Keep in mind, you’ll be forced to do all of these wonderful things - even if you just want to check your account balance. Since it’s such a hassle to use this banks services, I don’t see myself using this account for very much.",2,2023-03-28 17:06:46
"Chime is a meta bank so it isn’t accepted by 90% of financial institutions which will create a huge inconvenience for most. Also they are not even based in the US so you will be talking to someone in another country with English as a secondary language equally infuriating. Currently it’s been 2 weeks & I still haven’t received a replacement debit card after chime TOOK IT UPON THEMSELVES to report my card as stolen & cancel it the week I had a deposit coming when I had simply said “please block this merchant” which they’d done before without interfering with my card now it’s going on 3 weeks I haven’t been able to access my own money due to their sheer stupidity & lack of listening skills. Them being a meta bank I had thousands of dollars worth of unemployment money I desperately need & waited months for already returned because unemployment refuses to deal with them so now I’ve had to wait an additional month for that $ that I still haven’t gotten in addition to to the debit card debacle & often customer service will lie & said they did something to get you off the phone for you to later discover it wasn’t even done!!! This is how they treat a 2 year customer NEVER AGAIN! I will be cutting these cards & deleting the app, save yourself a tremendous amount of trouble & get a real bank account with a bank you can walk into",2,2022-12-29 22:39:10
"Not a bad app to bank with sometimes they have their issues but nothing major on my behalf that wasn’t handled immediately so far my lady had an issue that took to long to get resolved because it was a communication issue the people who she dealt with couldn’t comprehend what she was explaining but for the most part it’s pretty good take a little long to receive your new cards when you order them but ultimately the system they use has a lot of perks and when it’s running good it’s running good . When the app has issues it doesn’t affect your card use and they handle it quickly and it back up and running in minutes if not sooner so I give them 4 stars . Much better than most banks trying to sneak in fees to manipulate you out of money these guys keep it simple and the credit card you get with them is definitely a plus, helps you get back on track if your credit is not so good and keeps you informed and easy to use and understand . Gotta say the chime guys are good at what they do and the only reason they didn’t get the 5th star was the minor issues . Most of the people I know have it after dealing with shyest banks and I’ll admit I’ve promoted it to my friends and convinced many to get chime",4,2022-05-07 12:48:13
"They do not follow their terms & conditions, they do absolutely whatever they want and get away with it because you’re just one customer and they’re a big bank. Spotme terms & conditions clearly state that you need *MONTHLY* direct deposits of over $500 in order to qualify. I check my statements monthly, and my deposits are always well over $500. My most recent check on Jan 12 was less than $500- i was expecting that since it was from Christmas/New Years and my job is always slow around then. Well because of that, my spotme was turned off and now the app is harassing me to “set up direct deposit”. It would’ve been nice if they waited until the end of the month, when my monthly deposit would’ve been well over $500 again. Don’t ever bother reaching out to support, both people I talked to sent me the exact same email, word for word, that had nothing to do with what I asked. When I replied saying that’s not what I asked, I received the same email AGAIN. They’re very unprofessional, if you have a lower check than usual they’ll assume you’re not depositing your entire check and turn off spotme, and if you don’t tip them (never heard of having to tip a bank??) they won’t care about what you have to say or any problems you experience with them. When I asked if I had tipped for using spotme, would this happen and their response was “probably not”. So now I’m signing up for a new bank and my balance will sit at -$45.",1,2020-01-20 21:19:44
"Had chime for 4 years never did anything fraudulent and did not break any of the contract rules I had a checking savings and credit card!!! Woke up Monday morning and chime had completely closed my accounts with no pre notice or anything all three accounts where closed and I have to wait 14 business days before I can get my money mailed out to me in a Check!!😡 also chime stole all my money in my account I had $5,562 split between my checking savings and credit card! Come says that I only have $520 in my account! When I told them that is not true they told me to provide proof of balance knowing that they closed my account and restricted access so how can I prove it! Chime does not email or mail out bank statements every thing is done threw this app! CHIME IS NOT SAFE OR RELIABLE 
When requesting a reason for the closure chime emailed me stating that for privacy reasons they can not provide a reason for account closure!!! I can not get any assistance or answers from chime over the phone or on line / email ! Be Careful CHIME also known as stride banks are criminals they steal money and unlawfully close accounts with no pre notification! I was not made aware of account closure or anything before my account was permanently closed! Do not use CHIME banking ever they are criminals! If anyone knows how I can go about getting the proper legal officials involved in this please leave a response.😭",1,2022-09-26 17:29:49
I am not typically one to come online and write a review but I felt I needed to share my experience with Chime. I’ve been a customer for almost 2 years and the reason I joined was I was going through a financial hardship and I enjoyed the idea that they trust their customers enough to offer spot me as an option if they needed funds in between paychecks. Most recently I received a reimbursement check from State Farm that I attempted to do a mobile deposit through it was denied stating that I didn’t fill out the back of the check per their requirements which I did. I resubmitted the check then they decided they wanted to hold the check for over a week. I have been a great customer I have not had any return checks I have not returned any checks that I deposited it was very frustrating because State Farm even gave me proof that chime cashed the check and they still would not release the funds so they basically are holding my check hostage for another four days. I completely understand having policies and safeguards in place for the company but when the customer is telling you that they have proof that you cashed their mobile deposit you should be releasing the funds. I decided at this point to go back to traditional banking where I can make deposits add an actual bank and I don’t have to deal with this nonsense.,2,2022-08-23 19:17:21
"I have had friends and family have this app and everything work smoothly with everything especially on first paycheck. When my fiancé gets it for his job I warned him about the pros and cons, personally I don’t like the app nor use it for my paychecks. Suddenly his deposits cant come through and he calls customer support. They are the most rude and stuck up people I have every heard and did not help, they tell him it’s his employers fault and it’s on their end. He has told them three times with his boss present that they have the numbers correct and it shows that it sent through, it’s on their side and they get more defensive by the minute. I am disappointed heavily and we tried to be civil about it and she just would not listen and kept saying that it was on his end. Until things look up I won’t change this review and it’s sad it happens over a rude support woman that doesn’t have the listening skill and comprehension skills to acknowledge it. I always been nervous about this app and I finally been given every reason to. I am sorry to leave a bad review even after all the good things I heard.

Also I have heard of people during die to their money getting taken and chime won’t due anything about it and honestly it was needed and if it comes down to it I would sue too if scammers got ahold of my card and kept taking money out of it and the keep declining my dispute.",1,2022-09-08 03:03:46
"I tried out Chime for about 2 years. Previous bank being a traditional brick and mortar bank. Chime has caused me a lot of issues by taking way too long to process transactions. I recently got a fee charged to me of 150 dollars by the DMV for declined transaction because Chime typically takes 3-5 days to pay bills. An issue I never had with Chase. Chase withdraws the amount from your balance immediately even if it’s not yet fully posted, as a courtesy for customers. Chime will wait the full posting period before actually taking the amount off your account. Being low income and living paycheck to paycheck this caused me a great many issues taking way too long to deduct the amounts from my account. Sometimes over a week. I do the same exact payment on my Chase card and it happens instantly.  We almost had our utilities cancelled because Chime took over a week before they attempted to process the payment and by then I had spent what I had because I thought it had went through. This has happened to me so many times when I got fined 150 dollars by the DMV that was the last straw for me. Had to go into the DMV and pay with my regular bank card and it went through right away. Going back to a bank that processes debits instantly rather than waiting days. Cancelling this account",2,2021-07-24 02:18:09
"I was researching banking apps and I joined Chime because I read that they had $100 joining bonus for new customers providing they set up direct deposit and had a qualifying deposit within the first 30 days. So I did all of that and my deposit came through, but it was crickets regarding the bonus. I tried to call Lynn a few times, but each time I would get either disconnected or really bad reception. I finally called in about a month later and spoke to someone who was in charge, but he told me that he could find no record of that joining bonus ever been offered. He asked if I had a screenshot, which usually I do take screenshots of such things, but I don’t recall doing that because it was attached to the app and I didn’t know I needed a record of it. I told him as much and he said without screenshot as proof he could not honor the bonus. I told him I had done research since then, which was really done while I was on the call, and I had found proof that they have offered such bonuses in the past and that was evidence enough that what I read online at the time of joining was accurate. But that was not good enough for them. So my advice is either don’t join or if you do join, make sure you document any promises they make to you. They seem to be liars.  I will be switching banking apps because I don’t want people who don’t keep their word handling my money.",1,2024-12-26 19:46:57
"I’ve been banking with chime for over 4 years now and never had a reason to contact support. However, I woke up this morning to multiple unauthorized transactions totaling over $2,000 on my account. I contacted support and explained my situation to them and even included screenshots proving it wasn’t me. They stated that they would look into it and make sure my case will be resolved. Not even 5 minutes later, they denied my claims even with substantial evidence that I DID NOT PROCESS THOSE TRANSACTIONS. I called back and spoke to a guy named Juan, and after explaining the situation again, he stated that their might have been a mistake and they didn’t see the screenshots that were included and he reopened the case. I waited for 3 hours and called back, surprisingly it was Juan again who I was transferred to and he pretty much told me there’s nothing they can do about it even with the evidence that it wasn’t me. How is that even possible?!?! There was no real investigation done into my case and it got denied?!?! Will never be banking with Chime again!!! I really thought they were different from other banks and actually cared about their customers, but they’re just like every other bank. Money hungry, good for nothing, pieces of sh*t. I’m putting this review on here so people won’t have to go through what I did and to be cautious of who you bank with.",1,2022-06-03 18:37:26
"After seeing ads & TV commercials about Chime members telling their experience with Chime, I decided to give it a try. A few months after downloading it I noticed I really like it. It offered a way to get your pay check deposit in your card 2 days early & I switched my bank services over to Chime so that I can bypass all the hassle of waiting for the actual payday & it worked out for me. It also offered a credit builder card so I read about that & I ordered that card because it helps you to build credit of your own which is that I always was looking for a simple way to start building my own credit. After a few months of using to make purchases with the credit builder card I went to check my credit score online & it actually shows that my credit score is very good all because of Chime. I can’t thank you enough Chime for the services that you have provided which actually is true that you have really helped me to make & live my life so much hassle free easier. TO EVERYONE OUT THERE I VERY HIGHLY HIGHLY RECOMMEND THAT YOU TRY GIVE YOUR BANKING SERVICES OVER CHIME THEY MADE MY LIFE EASIER & IT WILL MAKE YOURS EASIER TOO!!!!",5,2023-09-16 19:32:41
"I’m loving my Chime account. Having all the functions easily accessed on my phone has allowed me to manage my money more efficiently and monitor expenditures in real time. The absence of high fees is wonderful. I love both the ease of transferring money between accounts as well as the Spot Me feature for months when the budget is very tight. Although ATMs that recognize the Chime card are not very common, I haven’t found that to be a drawback; I rarely carry cash at all anymore and haven’t missed it. I don’t miss having a checking account, since on the rare occasions when I need to pay a bill by check, I can do it through the Chime app for free. The only drawback I’ve encountered is that some businesses, particularly those that only exist online, do not recognize the Chime routing number. I’ve been able to find workarounds for all but one of them. I don’t know the reason they won’t accept payments from Chime, but hopefully Chime is working with those entities to remove whatever barriers exist. I highly recommend Chime. It’s more convenient and has saved me money over the months I’ve been using it.",5,2024-03-27 11:09:08
"In a world where you have BoA and Wells Fargo sucking not the just life out of your friends and family but the money you’ve worked hard for with their fraudulent activity and ridiculous fees and policies, you find Chime. That ray of sunshine and hope that not all banks are that evil. Chime has single handedly gotten me my 700 FICO credit score, my savings and retirement funds all kickstarted, and made me more money in just 3 months than anyone banking with BoA will ever see in their interest payouts over the course of the next 5 years. I cant recommend Chime enough to anyone that is living paycheck to paycheck, banking at a brick and mortar bank, just getting started, or overall just wants something easier and better for themselves. Literally 0 fees, easy access to catch withdrawals, deposits, bills, checks, transferring wherever to whoever, and that 2% APY is just the icing on the cake for the savings account. The only thing Chime can’t do is help you with a loan from my understanding but at that point, just go to a credit union! Time to ditch these typical scammy banks and treat ourselves and our wallets to the finer things in life!",5,2024-09-24 15:30:51
