userName,score,content,at
Amber Arthurs,5,"I love Chime. SpotMe and MyPay are just 2 of the perks that help this single mom of 3 maintain some sort of financial stability. living paycheck to paycheck is tough but when your bank wants to help Yu instead of hurt Yu, the difference is live changing. 10 out of 10",2025-04-05 06:20:04
William Lockee,5,it's great,2025-04-05 06:16:03
Steven Ardelian,5,thank you for helping build credit..,2025-04-05 06:15:01
Mary Udo,2,"I have no access to chime acct #, routing # no way to get SS ditect deposit. I need everything in one place. should I be patient until card comes. Social S is going to be a bear. ant help would be good.",2025-04-05 06:12:52
Billy Smith,5,love this!,2025-04-05 06:05:26
Wendy Cheney,5,"Love Chime! it's very easy to use, convenient and customer service is always very nice and helpful! I love the spot me, and I have never had any issues.",2025-04-05 06:04:31
Misty Parker,5,chime is great I recommend to all,2025-04-05 06:00:48
Gina Hampton,5,"I had an issue with my bank and had to close my account in a hurry. Signed up for Chime the same day and had a new account in minutes! Changed my direct deposit info to Chime and it did not take 1-2 billing cycles for my direct deposit as expected...I got my money the following week! I'm very excited about using Chime so far, as I am on the path to rebuild my credit. I like the notifications I receive every time a transaction occurs on my account. Thank you, Chime!",2025-04-05 05:38:58
Tara,5,absolutely love chime! only way to bank fr,2025-04-05 05:31:01
Jason L Stafford,5,great online banking app,2025-04-05 05:27:24
Hailey Nicole,5,absolutely LOVE chime. nothing compares. no bank matches the simplicity of chime.,2025-04-05 05:21:35
Marquis Kendle,4,great app,2025-04-05 05:21:12
Clifton Hardy,5,I love Chime its easy like 123!!! I want change it for nothing in the world so if anyone and I mean anybody if you wanna save money get you life better choose Chime your life will be better just join right now like Richard Swartz one tap thats all!!!!!,2025-04-05 05:18:05
Noel Boutte,5,my favorite money app. EVER!!!!,2025-04-05 05:11:51
Brian Oldham,5,chime is so amazing. I love chime. and i thank God for Chime.,2025-04-05 05:08:48
Zachary Onyan,5,it's been a great banking experience for me!,2025-04-05 04:59:14
Lisa Brown,5,I have had chime for years And I think it's the best. I love it.,2025-04-05 04:50:42
Dave Marzion,5,I love chime. it's very easy and safe.,2025-04-05 04:45:20
Tomiko Denmon,5,Amazing,2025-04-05 04:33:02
Ruben Tamez,5,awesome benefits,2025-04-05 04:27:58
Scott Paradis,5,chime has helped me tremendously,2025-04-05 04:21:09
Shannon Fadeyi,5,I have had chime for five years one of the best decisions financially made.,2025-04-05 04:17:38
bryan martin,5,love it... i dont see myself using anything else ever,2025-04-05 03:58:44
Jimmy Wages,5,"Very easy, and convenient to use. Versatile banking and friendly service on the go.",2025-04-05 03:48:59
Deddrick Smith,4,"THEY'LL BE THE BEST IF THEY ALLOWED YOU TO TAKE THE FULL AMOUNT OF THE MY PAY RATHER 15,20$ A DAY . OH IF THEY DO THAT THEN THEY CANT GET THE 2$ FEE EVERY TIME YOU TAKE THE ADVANCE. REPENT OR DIE PEOPLE GOD IS ABOUT TO RETURN",2025-04-05 03:42:07
xXWARHEADXx X,1,So the dingdongs in California updated the app and buried the lock/unlock feature. you have to go to profile and then scroll down to cards to unlock your card.,2025-04-05 03:32:01
rallie christie,5,an amazing app,2025-04-05 03:27:04
Travis Harris,5,good up to 2 day early pay spot me Wich I am not in but will do up to 200$ with 20$ fee Wich is cool but on a other app I can get spotted with not fee of 20$ only downfall so far,2025-04-05 03:09:36
Jane Doe,5,life saver always on time,2025-04-05 03:09:13
CorasHarvest,5,I love the new look of this app! It's so easy to navigate. Thanks for Chime+. 🙂,2025-04-05 03:01:31
Chris Chamberlain,5,easy to sign up for and down load,2025-04-05 02:45:57
Young Hippie,5,easiest online bank to use,2025-04-05 02:44:08
Woodrow Elam,5,Great service and cares about the people.,2025-04-05 02:43:04
Cent V.,5,I love Chime. it's great!!,2025-04-05 02:34:20
Linda Washington,5,l ail ready have a account.,2025-04-05 02:32:53
Denise Mcdonald,5,"i really appreciate chime banking I was a little hesitant, for the last 2 months I've been getting direct deposit through my app I'm very happy that I decided to use online banking",2025-04-05 02:11:06
Christian Medlin,1,Don't like the recent layout update. Please give option to revert.,2025-04-05 01:57:42
B M,5,been using them for over 5 years. best bank I've ever had,2025-04-05 01:50:37
Domo,5,I love dis app,2025-04-05 01:37:24
Sherella Andrews,5,I love chime my money is always on time,2025-04-05 01:20:38
patty cox,5,wonderful,2025-04-05 01:11:51
Jason Brooker,5,Chime is my go to mobile banking app and I have a few. The features offered and the new interface is much better than what it used to be. I give this a 👍🏻 up.,2025-04-05 00:19:29
Carol Rush,5,Chime I am great Banking app! It has helped me many times,2025-04-04 23:27:06
Angela Smithhart,5,"love that you can turn the card off when not in use, thank you chime",2025-04-04 22:50:02
Kandi,5,way better than cashapp,2025-04-04 22:25:33
Eddaevette Pizarro,5,it's a really good app,2025-04-04 22:11:23
Patrick Volkman,5,easy to use and very helpful,2025-04-04 21:54:41
Monique Martinez,5,great.,2025-04-04 21:50:22
Jacqueline Diaz,5,I love chime cuz I get paid 3 days early and they spot even if I don't have it in my check thing I don't like about it is I can't let chime people money if I only have spot me other than,2025-04-04 21:48:22
DJ B Entertainment,5,The credit builder is unmatched. and using it a few years and it really works.,2025-04-04 21:26:05
Tommie Collins,5,Great experience!!! trying to find out more about this Chime.,2025-04-04 21:20:05
April Smith,5,I love it,2025-04-04 21:19:52
Leigha Bennett,5,great app,2025-04-04 20:59:09
Tim Hoey,5,better than any of the physical banks...bof..wel...etc.,2025-04-04 20:47:10
Vickie Noe,5,"They are helpful when the purchases go below 0$ in the account. No service fees. I appreciate that very much. Helpful additio n al features like gas discounts etc. automatic savings deduction, if only I'd h Ave enough to leave it in my Savings account.",2025-04-04 20:30:19
Skippydemitro35,5,💯,2025-04-04 20:27:39
Patricia Guill,5,Best banking ever! I love the way they take care of my monies and all the extras that they provide!,2025-04-04 20:23:57
Megan Chatman,1,I've been a member since 2019 & now that I have a problem like FRAUDULENT charges I get nothing from customer service.,2025-04-04 20:15:58
Ezekiel Caldera,5,thank you chime for being the best bank out there,2025-04-04 20:10:47
D Colbert,1,The spot me sucks and the pay advance is a trap,2025-04-04 20:09:49
Dawn Morris,2,not a fan of all the new virtual cards added without permission to my account. all the fees are ridiculous. the only way to have the send friends $5 on the 1st of the month is if u have direct deposit is also discriminatory as well i think. I'm actually about to cancel my chime account to be honest with you. so sad. been a client since 2018.,2025-04-04 20:03:52
Gail Reed,5,"since I have been with Chime, my credit score has gone from 375 to 732. My pay allows me to get money when needed. I love all the amenities.",2025-04-04 20:01:35
Sylvia H,1,why does it take 3 business days to open it's so slow!,2025-04-04 19:43:47
David M. Ellis,1,"hate chime. I hate I can not get too my funds after bith multiple employees and supervisors failed resolving my lack of access to purchasing or spending my money held hostage for a week and a half while I literally go hungry, feel humiliated, especially on the phone with most their agents. I don't like tat their troubleshooting comes down too the customer jumping through hoops on our end, and Not once was a tech or anything utilized to fx my issues with their system. I hate chime. leaving.",2025-04-04 19:34:49
Cynthia Branstetter,5,Love it. so easy to use,2025-04-04 19:34:04
Kristen Jones,5,"Despite not having any branches, this is by far the best banking I've ever had. the credit builder WORKS SO WELL! The spot me and daily pay options are Life savers!",2025-04-04 19:28:36
Misty Vandivor,5,love this financial system,2025-04-04 19:26:39
Anthony King,5,great,2025-04-04 19:24:19
Bob Hoffman,5,I love chime,2025-04-04 19:15:43
Lourdes Torres-Marrero,5,"Love Chime. No overdraft fees, get pay early. You can send money to others easy. Compatibility with cash app. I wish the put zelle on.",2025-04-04 19:05:00
Smoky Mtn Mom,5,I would not use any other bank . Chime is awesome. Excellent Customer Service.,2025-04-04 19:02:14
Sheila Douglas,5,it's easy to navigate,2025-04-04 19:02:00
Rick james,3,I like the availability of atms and how easy it is to move money around. I absolutely hate that fact there's no way to withdraw money in a timely manner if needed.,2025-04-04 18:57:32
Guy Evans,5,Best banking I ever had. Awesome 👌,2025-04-04 18:56:08
D Grott,4,only thing missing is the spot me could be higher 30 buck? should be 100,2025-04-04 18:55:22
Joseph Long,4,"The only thing I'd complain about is about once a year, the system goes down, and I can't use any of my cards or withdraw cash and I don't get notified via email, or otherwise. So, the only way I know is when my card gets declined, which is embarrassing. Otherwise, I can't imagine using another ""bank"". Great customer service, no service, or hidden fees.",2025-04-04 18:47:30
Joylynn Shay,5,"Chime has been the easiest, safest app I have ever banked with and I refer Chime to all of my friends as I love that my credit score has gone up so much since starting to use this app and savings is made so much easier.",2025-04-04 18:45:39
Brenda “BrenBren” Mcmurrin,5,Chime is amazing I love them,2025-04-04 18:24:40
Scott Murray,5,good,2025-04-04 18:15:25
Mark Massingill,5,Very Good App! Easy to use! Highly Recommended!,2025-04-04 17:58:01
Cheryl Darden,1,do not like the colors of the new app. hurts my eyes. too bright.,2025-04-04 17:55:41
Anne Dillard,5,Time is there where I can get my money early and still get help when I need it.Thank you Ch,2025-04-04 17:50:37
Mamalona Sanchez,5,"always helpful,when I need extra 🤑",2025-04-04 17:45:48
Eric Metcalf,5,just Great,2025-04-04 17:40:25
Nuke Nuke,5,no issues,2025-04-04 17:38:20
Dawn Blackwell,5,It's a really GOOD card,2025-04-04 17:29:40
Brandon Chittock,5,I love this Bank!!! no banking fees. they have credit builder which has helped me build my credit over 760 points,2025-04-04 17:24:03
Derrick Easterday,5,Great app so far way better than other online banks IMO.,2025-04-04 17:03:22
Fred Cook,5,great,2025-04-04 16:59:16
thomas mazza,5,paid 2 days early move money anywhere instantly super user friendly no bullsnuff just banking,2025-04-04 16:53:54
Corey Taylor,5,Great banking account and the app works fantastically as well.,2025-04-04 16:48:39
Kelly Kelly,5,I love the getting my check early and definitely love the spot me. it's a great way to built your credit as well.,2025-04-04 16:47:54
Tracy Westover,5,"I've been with chime for years and haven't had an issue, the MyPay and the loan comes in handy if I just happen to have to use it and need it for a bill or something. it's great if you don't have it you should try it",2025-04-04 16:45:33
Debra Nichols,5,I love everything about chime..banking made easy.,2025-04-04 16:43:49
Jerome Bailey,5,"since I been with chime, life has been easier then a normal Bank",2025-04-04 16:37:14
Carmon Lowery,5,I send money direct deposit i trust it it's great,2025-04-04 16:35:52
Sandra Clark,5,Best banking app!,2025-04-04 16:18:15
Cindy Jirgel,5,Love This Great Option besides Ugh Banks. who charge to have Ypur $ in them.,2025-04-04 16:10:46
Vincent price,5,"CHIME ISSSS WERE IT,S @T,S.....",2025-04-04 16:10:12
Ronald Thompson,5,"I love ❤️ my chime !! Been using chime for over 3 years, never had any issues.",2025-04-04 16:09:33
Curtis Jackson,1,doesn't allow me to move money from my debit card to my chime account. been doing it from a while and customer service cant fix it,2025-04-04 16:05:41
Ángel,5,Great!!,2025-04-04 16:04:43
Ted Thomas,5,"so convenient, easy to move my money around. only wish savings was harder to access to make saving money last.",2025-04-04 16:03:28
Kris Knauff,5,"wonderful, life saver so easy to use",2025-04-04 16:03:19
Stacey Richards,5,Great bank! I've personally never had any problems whatsoever!,2025-04-04 15:59:52
Alice Elizabeth George,5,love banking with chimes just as good as a old friend they are always there when needed,2025-04-04 15:58:08
Linda Perkins,5,Hand down the best place I've ever bank with for my checking. The help is fast and on top of everything I do and don't do. Recommend everyone to bank with.,2025-04-04 15:54:22
Mike Visconti,5,The best. Been using Chime for 2 years . also have credit builder my credit score went up 84 points. I have credit cards now.,2025-04-04 15:52:53
Bill Howard,5,so far so good,2025-04-04 15:50:51
Billy Gahlenbeck,4,"payed my insta loan in full on the day the first installment was due, then you get penalized for doing it so you have to wait 30 more days before you can use it again",2025-04-04 15:47:02
Heath Trent,5,I have always had a great experience with chime,2025-04-04 15:44:36
Leigh Haynes,5,"Have been using this banking service and app for years. It's very efficient, user friendly and their Customer Service Team is awesome!!",2025-04-04 15:43:07
Terri Barron,5,all good things to say!,2025-04-04 15:38:11
Solidad Almaraz,5,Solidad Almaraz this is the best to always carry and have deposits made to you're never lost without your chime this is the best card I've ever had since I've been using cards I dropped my bank account and went to chime and I am so happy to have it,2025-04-04 15:36:54
Greg Psioda,5,After being with him for 5 years I wouldn't even think of banking anywhere else... no local bank can do what they do,2025-04-04 15:35:54
Steve Mjehovich,5,everything you do helps thanks done,2025-04-04 15:31:04
Daniel Rasey,4,so far so good,2025-04-04 15:20:42
William Robinson,5,Best thing ever for me,2025-04-04 15:17:36
Ricky,5,clutch,2025-04-04 15:12:15
Xcel Yeti,5,GET THE CREDIT BUILDER CARD !!!,2025-04-04 15:08:03
Yvette Spell,5,the app is wonderful I like it so far,2025-04-04 15:07:54
Darlene Clark,5,Clear to understand.,2025-04-04 15:04:31
Venise Ledford,5,awesome,2025-04-04 14:54:15
Diana Cheang,5,I love chime,2025-04-04 14:42:46
L. Staler,5,I love chime I like some of the benefits that has that I've taken advantage of but it's kind of hard to be on disability but I manage keep up the good work,2025-04-04 14:42:02
Patrick George,5,they're a life saver the 200 spot me helps me every time,2025-04-04 14:31:27
Jony David,5,I think that Chime is a good banking tool. I like that you can instantly pay anyone even if they don't use Chime.,2025-04-04 14:29:33
Holly Hakel,3,you lowered my pay cause I made more in Feb then the same as I always do each month for work deposits. so I'm being penalized for getting my tax refund,2025-04-04 14:23:44
Ella Alexander,5,absolutely the best. I've never had any problems!,2025-04-04 14:22:49
Stephen Collins,5,Love the saving option so much.,2025-04-04 14:16:15
Kimberly Hazinski,4,"I like the quick functions but it however lies about the 500 credit against your paycheck. evidently it needs to tell everyone that it's actually according to when an how often that will determine the amount they will loan out. So their ketch frase should be changed or tweaked a little better so it doesn't confuse older user's. just a heads up. And pretty much it takes you to ,if it sounds to good to be true then it isn't.",2025-04-04 14:10:05
Reggie Womack,5,great online banking service 👌,2025-04-04 14:09:59
Toccarra Williams,5,I have had them for years now and I love my features from building credit to literally pay me luv it ❤️❤️,2025-04-04 13:53:06
Rhonda Ellis,5,love it,2025-04-04 13:34:25
Dayna Joshua Drake,4,awesome for all my banking needs. not good with disputes.,2025-04-04 13:33:19
Shelly Bergan,4,love MY Chime!,2025-04-04 13:32:50
T. LaShawn,3,it was rather nice. if I had to say anything negative.. I had $50 on my credit builder card and it disappeared from before my eyes.,2025-04-04 13:32:45
M A,5,chime is just plain awesome. No more overdraft fee is a huge plus,2025-04-04 13:31:11
Lindsey Taylor,1,"chime was great when I got on 2 years ago. I have to admit since they initiated the MyPay feature I haven't been able to get a real paycheck, because most of my checks are going towards paying back my pay and the spot me I'm looking to get a bank account somewhere soon take this submit to Heart",2025-04-04 13:30:49
Shane Wmzz,5,better than cashapp!,2025-04-04 13:20:19
Ashley Deas,5,just an amazing app so easy to navigate,2025-04-04 13:11:31
Roronoa Michael,2,Mypay leaves you in a place that hurts more than helps,2025-04-04 13:06:39
horacio carvalho,5,awesome,2025-04-04 13:00:48
K. White,5,"Second round review, just qualified for Chime+ and been watching the MyPay adjustments. I can say I am 💯 on Chime Banking. As someone who has previous career history in the banking industry, I can say with confidence I trust their services and I am very satisfied with my experience as a customer.",2025-04-04 12:53:30
Nicole R. C.Fuhrer,5,I love chime. spot me is a huge help and being able to access a portion of my next paycheck is awesome. I can also set aside savings as well as round up change to my savings. its a great app.,2025-04-04 12:42:06
Jake Guitron,5,I love it! Best ever! Ugh!,2025-04-04 12:40:36
Marcus Fields,5,love it,2025-04-04 12:39:38
Miguel Caban,5,is the best card I have in my wallet,2025-04-04 12:38:08
King Drizzy Hondo,5,It's a really good app to use!,2025-04-04 12:34:49
Ed Camp Jr,1,watch chime i got legit scammed out of my paychecks and my saving by people calling from there number i called and try to get my money back they told me a basically beat i even have a police report and all next step is to take them to court and go up to my congressman to get my money back be aware they know about this scam and refuse to do anything about it the scammers had my account information and detailed transaction you can look the scams up on YouTube,2025-04-04 12:34:40
Joan Parker,5,Best Bank Ever!,2025-04-04 12:34:17
Gloria Lucas,5,"The notifications are on time. Spot Me is a real hero. Thank you, Chimes!",2025-04-04 12:33:32
Mary Rogers,5,Love the options for instantly transferring money!!,2025-04-04 12:32:21
Marlene Shields,5,"I love Chime getting paid 2 days early, being able to have my pay and spot me helps me out through the month",2025-04-04 12:29:27
Nick scanio,5,Let me chime you in on this iv been with these guys since 2018. not only has this been the best online banking. this been the best banking experience iv had so far,2025-04-04 12:26:37
Tony Castro,5,The best online bank ever! Thanks Chime.,2025-04-04 12:19:49
Charles Ramsey,3,"used to love using the chime card. still do really except recently, logged into my app and suddenly the app was no longer compatible with my device. Not liking that I'll have to buy a new phone just so I can use the app. Everything else about I love though. Never had any trouble with it.",2025-04-04 12:19:01
Annalen Samons,5,"I love Chime, their the best!",2025-04-04 12:16:41
Anyssa,1,"I gave chime on one star because they were disputes that I had that took over 6 months for them to keep denying which were totally legitimate. I was scammed by somebody and they were unwilling to work with me to get my money back. they asked for a lot of information, which I gave it to them but it was repeatedly and I still not able to get my $300 back. I stopped using chime for direct deposit just solely off of that.",2025-04-04 12:15:46
Josh Strickland,5,I absolutely ❤️ chime!! they have helped me in so many ways!!,2025-04-04 12:07:41
Susan Green,4,I like how when some random transaction happens in my account they check with me to make sure I was the one making purchases.,2025-04-04 12:04:45
Tabitha Hall,5,love that my auto payment comes early. it really is helpful with bills.,2025-04-04 12:03:19
Chocolate Spiderman,5,the app could use some work but they're overall service and things they provide that's definitely bailed me out of some situation through the good and the bad thanks chime,2025-04-04 12:03:00
Ana Roldan,5,Love it,2025-04-04 12:00:42
Troy Anderson,5,Excellent Customer Service,2025-04-04 12:00:08
Barbara Fee,5,"lov that i haven't had to pay overdraft fees. everything gets covered, and my credit score has gone up. plus, the app makes it so easy to control my accounts.",2025-04-04 11:53:28
Jennifer Boston,5,Great card you can do anything and everything with this card,2025-04-04 11:50:56
Kat Britt,5,"Easy, convenient and good customer service.",2025-04-04 11:48:45
Marion Smith,5,I love the fact that I can get my pay check early and helps re builds my credit. This cards is a beautiful thing to have if you have bad credit.,2025-04-04 11:41:55
Michael Hester,5,I like chime especially the amount of locations I can use,2025-04-04 11:41:20
Brian Terry,4,we enjoying the time,2025-04-04 11:37:42
Timothy Baldridge,5,Chime is really a good thing!!!! When you need help it's there with you and your families troubles. Give it a try and remember it's worth it.,2025-04-04 11:31:07
Marti Solano,5,I love using this mobile banking app! it's the best,2025-04-04 11:18:16
Bobbie Campbell,5,very remarkable an incredible 👏 app in the world 💪🌍,2025-04-04 11:16:33
Myah Hyatt,1,closed my account for absolutely no reason! couldn't give me a reason when I called! do not recommend,2025-04-04 11:04:41
Martin Porche,4,great app makes banking convenient,2025-04-04 11:01:50
Sonia Hernandez,5,good stuff,2025-04-04 11:00:09
Brenda Adams,5,I love chime,2025-04-04 10:53:21
Alice Dozier,5,Chime been great and very easy to use,2025-04-04 10:52:19
Steve Kolesar,5,Chime is awesome in every way!,2025-04-04 10:49:54
JoAngela James,5,I Love Chime,2025-04-04 10:48:19
Jamil Garretson,5,great,2025-04-04 10:45:53
Billy Apple,5,love chime been using it for 4 years now I won't use anything else great card honestly,2025-04-04 10:38:27
Valerie Willliams,4,very easy to use I also like the options they give you .,2025-04-04 10:38:23
Cyrille Njichoi,5,cool,2025-04-04 10:34:04
Von,5,GREAT!!!.. Very easy to use & explains everything in details,2025-04-04 10:29:46
Marilyn Ancira,5,I love spot me it's a life saver and customer support is great!,2025-04-04 10:20:41
Joe West,5,it's a pretty awesome card you pretty much have 4 cards 2 cards for your wallet and 2 virtual cards on the app can lock any one at anytime really good card lots of perks,2025-04-04 10:18:54
Mint Goss,5,Great Card love it,2025-04-04 10:16:27
Raymond Thomas,5,it has a lot of good benefits.,2025-04-04 10:15:28
Winda Turnbull,5,enjoy using chime,2025-04-04 10:13:23
Reo Dewan Smith,5,2024 Awesome 💯😎,2025-04-04 10:12:59
Fj Lucero,5,itis there when i need a little extra. the more income the more help,2025-04-04 10:05:18
Aaron Lunde,5,I have used chime for over 3 years now love them and all they do,2025-04-04 10:02:28
Ovie Duncan,5,good app,2025-04-04 09:56:20
Paul C,5,Does everything it promises to do. Is truly a one stop banking solution for all your financial needs . AND all with NO FEES for anything.,2025-04-04 09:54:02
Dell Runyon,1,the new format is very hard to navigate !,2025-04-04 09:49:59
brittney franklin,5,I don't like how mypay is being done. one month you have a loan the next it takes the loan. i don't like the fact it has to build up to borrow. other than that I like it.,2025-04-04 09:47:30
Amy Miller,5,so easy and convenient,2025-04-04 09:34:20
Stephanie Lane,5,good,2025-04-04 09:20:38
Debra Norris,5,chimes keeps me on a budget,2025-04-04 09:19:18
Susan Tucker,5,It is so easy to use and you can basically do everything without assistance.,2025-04-04 09:18:52
Shana Wilcox,5,great app great people,2025-04-04 09:11:20
Leah,1,So this new update is a bummer for a drod user. I can't get it to install and I have tried like 10 time! I have been online with Chime customer service and they seem to be no help. Any suggestions??,2025-04-04 09:09:04
Dianna Rodriguez,5,Chime is the best banking service i have ever tried. I love it!,2025-04-04 09:08:30
Tabatha Mounkes,5,amazing,2025-04-04 09:05:13
Victor Palomares,5,"been with chime for years (practically day one) no issues, cs is top notch, early paydays never an issue",2025-04-04 09:02:43
Jenise,5,"I love chime, it has no hidden fees, it has overdraft that is free, and after a short time it offers you a loan for a few dollars extra. It will also help build your credit rating. Thank you chime for being there for me.",2025-04-04 08:59:21
Ladyeve,1,i don't appreciate having to pay you $2.50 plus the fee thru the ATM if I don't use an ATM in walgreens. so I'm spending $4.00 to get $50.00 no good,2025-04-04 08:57:38
Aiden Stuhlmiller,1,"Don't know why but the My Pay balance thing doesn't work for me anymore. I don't get paid much though I do get paid every week at least up to $200 so if I was able to pull out $40 extra it would really help now and then so I can afford food. Forgot to mention that the My Pay Feature has been at ""$0"" for about 2-3 weeks which is why I'm complaining in the first place. Not even getting at least $20 just stays at $0.",2025-04-04 08:55:52
victor marcano,5,The best card I ever had,2025-04-04 08:45:40
Wallace Franklin,1,can't enter code to reset password,2025-04-04 08:43:43
Patricia Winsor,5,I love Chime,2025-04-04 08:40:21
Leo Byington,5,Best app ever.,2025-04-04 08:40:12
Rhysen Swan,5,I've never had any issues with Chime. The Chime Credit card has helped me build my credit as well.,2025-04-04 08:38:57
Johnna Williams-Mitchell,5,y'all the best with everything you do,2025-04-04 08:34:09
