review,rating,date
"I've used Chime for over two years, and it has denied every mobile check deposit I have tried whether personal check, company check, government check, or any other kind of physical check. So, I have to take any and every check to some other banking establishment to cash it with a fee and then pay a fee to have it deposited into Chime in increments at a time at places like Walgreens or Walmart, so I never even get the full amount of any check I receive. I follow all instructions by Chime exactly to a tee and have contacted Chime via chat, email, and phone, and they can never give any reason except that the check wasn't accepted by some panel of a few people somewhere who make these decisions, with their apologies. In fact, the only explanation ever given and repeated even by agents over the phone is that the check was not accepted and not to attempt to deposit it in Chime again, but that the check hasn't been cashed so I can take it to another banking institution to cash it. That's it. No further reason or details, regardless of what kind of check or who it's from as I stated above. And it happened to me again today with another check not accepted.  Otherwise, Chime is convenient if you never use cash or any form whatsoever of physical money.",1,2022-03-18 12:08:06
"They advertised $100 spot me limit, I’ve had them almost a year, close to $40,000 I’ve put in this account in 10 months and they’ve only given me $20 spot me til this day, on the very few rare times you can actually get through on the phone (Customer service is a joke that’s non existent) they always tell me they can’t lift my spot me limit to their advertised $100 limit. They need to be sued for false advertising. If you ever have a problem with a charge, good luck getting through to a live representative, they forward you to a chat box in the app in which they took 3 days to respond to me in ( I’ve Got The Receipts to prove it ). I highly suggest signing up for other banks that actually give you what they advertise like Current, who pays you up to 2 days early ( chime advertises 2 days early but I’m never paid then, always paid 1 day early) and actually gives you the $100 credit limit. Chime is a joke that I’ve waisted almost a year of my life dealing with, credit builder was the only thing that stopped me from closing sooner, but it’s been 2 months and they still haven’t reported to 1 bureau after I’ve spent $4000 on their credit builder card ( I’ve got proof ). If i could give them -10 stars i would, i think it goes without saying that i dislike this joke of a bank. DO NOT BANK HERE !!! TRUST ME !!!",1,2021-01-25 00:57:20
"I was at work getting notifications saying someone is taking money out of my account. Imminently called chime to tell them that it is not me because the transactions were made in FLORIDA!!! I’m in Wisconsin… give them all my info and send them my schedule and time punches saying that it’s not me and that I am at work NOT FLORIDA! They continue to take more money out of my account all my rent money actually so also couldn’t pay rent on time, but what’s funny is they(chime) keeps saying that there is NO mistake in the transaction so not only did they not help me in anyway in this whole incident I lost a months worth of MY HARD EARNED money worths of rent. No compensation or credit. They will not help and the extra security they have you installed and it doesn’t do anything to help either they will continue to leak your info and give it out to random people. I’m only a young adult and trying to survive so this was a big blow to the face because I did like chime for a long time but I think this just proves that not all are good so please if you still want your hard earned money do not get chime. If I would put a zero I would because at this point the only resolution I have is to just close my account. So please again do not get chime if you don’t want you info leaked and money taken",1,2024-11-20 18:32:07
"When I was having a difficult time getting a debit card chime signed me up with a $0 annual fee, and no minimums!  They sent me a card within 7 days and still no fee. Then a few months of keeping a good balance and no problems they sent me a secured credit card to help me build my credit back up. And after using it for a few months I got upgraded to a all metal chime credit card. Still my favorite card to use! Haven’t had a single problem with Chime (unlike all the other banks I’ve had). I also recently had to use “spot me”, which is essentially their version of overdraft protection. However the big difference is you don’t get charged a fee to use it! Nor are you required to make your account positive by end of business day. In fact as long as you pay it back within a few weeks you don’t get charged a single fee! Absolutely amazing I Would highly recommend whether it’s your first account or your just tired of dealing with the big banks and all their hidden fees!",5,2022-09-10 05:02:40
"I got this account with the debit card with the spending account and the credit card for the credit builder account. I also put money in my savings to save up. I did this all to help me save money and to help build my credit score. At first it wasn’t showing up on my credit report until I reported it multiple times to a robot. Can’t even talk to a real person. And today I checked my credit score, it made my score go down 53 points. I was 10 points away from being able to get a home owners loan and now I’m screwed. It also reported that I owe $57 and I don’t owe any money. I have made every single payment on time. This was the worst decision and I wish I knew before I completely screwed myself and ruined my credit. I’m beyond angry. This was suppose to help and it hurt me more than anything. Even more than owing on other credit cards as well as being late on another account AND owing medical bills. DONT get an account with Chime if you are trying to better yourself because it will only hurt you I’m so upset right now I don’t even know what to do. This is the worst thing that has ever happened to my credit. And the house I was about to get for my family, isn’t going to happen. I’m angry and I’m hurt and now my family has to suffer because of it as well. This is an absolute outrage.",1,2021-01-30 02:47:19
"i reached out to support via live chat because my bank (Citizen’s Bank… a huge, popular chain) sent 2 sample deposits to Chime to verify they could successfully send money to the account i was adding. i believe Citizen’s might have tried to withdrawal too early - before the 2nd deposit came in but after the first - so the funds were not available and it was declined. i received an email from chime stating “ Hi Sarah, A direct debit for $0.84 by CITIZENS was declined because there are insufficient funds in your Chime Checking Account and SpotMe does not cover direct debits and ACH transfers.¹” I then received an email from Citizens stating “ To verify this account, we attempted to make two small transfers into your account and one withdrawal from your account. Unfortunately, our attempts have been unsuccessful. This is because The Bancorp Bank, Checking has indicated to us that the account for which you have requested verification is unable to accept transfers.” i chatted Chime and told them they had 2 business days to resolve the issue or i would close my account because it had already been a headache. they escalated the issue and said i should hear back in about 4 hours. 48 hours later, no word. my account is now closed. save yourself the time and do not open a chime account!",1,2023-01-25 16:01:03
"If I don’t receive my Chime card by Monday. Chime loosing a new customer and customer service is down how. Very suspicious things with Chime that puts red flags now. I’m stepping out on faith by joining. Now I’m regretting the whole account I opened and also did the direct deposit which makes thing even worse for Chime. I give the lowest star until my card arrives and I am able to get my money. The customer service is rude I talked to a supervisor name Sylvia she says they can’t expedite mail why not. Every prepaid debit card company has that option. Yes I reported them to the better business bureau FDIC and other accredited agencies. When it comes to my money I can careless. They playing like they can’t track it or see what’s going on I’ll just give a boost and a push so Chris, Chime CEO please expect a lawsuit from me due to this matter. I don’t care about who doesn’t like this review neither. So Chris, CEO get me money now to avoid it or just deal with it. I’ve made police reports about this matter. The AHC or ACH options seems to me as not an option but they will send the link. Chris, CEO you will be hearing from my lawyer. CEO Chris I’m taking this matter to the press today at noon. It’s ten days later no card and Chime can’t expedite another card well I’m going to explain everything to the news press today at noon.",1,2020-02-08 09:50:26
"It is true that people write a bad review before a good one. Overall I enjoy chime, I get paid early and with it being a holiday week I got paid EXTRA early which was a pleasant surprise. They did have a recent shut down that did decline our cards when we tried to use them for 2 days which was inconvenient and kind of embarrassing but the issue was fixed and they continued to show remorse. My only suggestion is I wish it showed the ending balance as purchases are made on the statement.  I don’t like not being able to look back on purchases of deposits and not see what it brought my balance to at that time. I work at financial institutions and sometimes that’s what we require for proof of payment, so the fact that my bank doesn’t provided that is something that definitely sticks out for me; and in general it would help me keep track of my spending a lot better to know what I keep my balances at throughout the weeks. They seem good at looking at reviews, not sure if this is a concern for anyone else to make it a change but it would be nice if that be involved in a near future update.",4,2019-11-26 12:27:27
It’s disgusting how chime is slowly handling my situation because of chime I’m forced to sleep in the car with my kids !!! And chime is doing absolutely NOTHING about my account !!! I have done everything asked and I’m constantly having to wait and wait and wait and for them to keep telling me the same thing. WHY does it take 24 hours to send a email ….. then it’s a email of the same information I have already provided by far the WORST EXPERIENCE !!! How many 24 hours is my kids and I going to have to sleep in a unsafe environment HOW many 24 hours am I going to have to tel my kids I can’t feed them because I HAVE NO MONEY I have lost my job thanks to chime and I will be loosing my kids if this situation is not handled chime is causing more problems in my life by taking EXTREMELY LONG TO HANDLE MY SITUATION chime does not care how severe my situation is and I’m disgusted at the entire process and I will NEVER bank with chime again !!!! how many times to I have to call it’s really sad and I will end up killing myself at this point because chime is RUINING EVERYTHING FOR ME OVER THIS LONG PROCESS CHIME IS ALLOWING MY KIDS TO GO HUNGRY !!!!!! DO NOT BANK WITH CHIME BECAUSE THEY DO NOT CARE ABOUT THEIR CUSTOMERS BECAUSE I HAVE CALLED FOR OVER A WEEK NOW IM LITERALLY LOOSING EVERYTHING BECAUSE OF THIS LONG PROCESS VERY UNHAPPY,1,2022-10-15 18:49:59
"I’ve been a user of Chime for over a year now and I wish I could be pleased with this company. The $100 limit for SpotMe is impossible to attain no matter how frequently your paychecks come or the amount they come in. I’ve been a faithful repaying customer in SpotMe over the last year and my limit only reached $45, then fell to $20 when I lost my job due to Covid. I referred over five friends who signed up for chime through my link. The link my chime app gave me was faulty and didn’t give me proper credit for the incentive, so I forwarded Chime plenty of screenshots and emails proof so that they would see I was the reason for those new users and get the incentive. Chime did not apologize for the faulty link, did not accommodate any type of manual incentive, and the agents who responded closed all of my issues and told me they couldn’t do anything. If you have any type of issues with SpotMe or the friends incentive, chime agents can do nothing for you. They give you long wordy excuses about how there’s many factors involved and how nothing can be done and close their issue. What’s the point of having representatives if there is nothing they can do, even to keep a loyal customer. This company is a scam, go to a trusted bank if you want to see them follow through with advertised benefits because this isn’t for you.",1,2020-07-14 16:08:23
"I’ve been a chime member for a few years now and unlike local branch banks or fdic banks, after you’ve been an account holder for a little while they allow fee free overdrafts! They do this for up to a certain amount and if you have friends that also have chime they can boost you every month to up that amount, giving you more to overdraft and it just comes off your next deposit! They’re easy to contact and get help from, after moving to California and losing all my info I called them and they helped me get all my information back with a few security questions of course. You can quickly transfer money between credit checking and savings accounts as well as send to other people with chime from the app! The credit card is AMAZING, just move money into it to your desire each month and as you use it, they report to the credit bureaus and build your credit rather than having to pay a deposit to get a secured credit card! They’re a pretty awesome online bank and I don’t know that I’ll every stop using them!",4,2024-09-22 00:50:32
"I’ve had zero problems using Chime and the Chime app! I’ve had some rough patches I needed to go through financially during my period of filing for disability. No fees to deposit cash at my Walgreens! When I had to have auto draft, Chime was able to stop any charges for NSF while I scraped up what I needed to pay the auto draft the second or third time through. No fees whatsoever. Not even from who was attempting to take the auto draft since it hits it every couple days or whatever to try to auto draft it. This gave me time to get the money needed into the account. I’ve had customer service help me during another issue that was resolved in my favor. I also have direct deposit with them and they never have any issues with my money being there. Everything I do to manipulate my money is simple with the app. I have paid zero in fees for anything. I had no problem trusting them with a settlement check direct deposit, either. No need for me to ever change my banking service. Ever. Great job, Chime!",5,2024-10-19 22:56:48
"This was the first time I opened an account at a bank I could not physically attend. This was a brand new account. Decided to have our refund deposited into it. BIG MISTAKE. They started asking for proof of refund which we sent. They pushed the funds through. We had access to the funds in the account for over 2 weeks after the fact....Then, I try to log in to check the balance and pay a bill...account suspended. The only explanation I was given is that something (that something could never be fully explained) was falling outside of their banking terms? They asked for a bunch of other info (License, SS cards, Utility Bill) to unsuspend the account. I’m like REALLY?? Can someone tell me what is happening? Nothing. Me thinking it’s just some kind of misunderstanding I sent in the necessary documents and still no answer. I’m now feeling like my money is being stolen and we’re being defrauded! They have over $2k frozen that we can’t get an answer as to why! I’m so upset I could cry. I have no idea what happened, I’m getting no explanation and I’m in the process of seeking an attorney! This bank takes people’s money and suspends accounts for no reason and provides no explanation. Do not trust them with your money!! 8 years I’ve done the same transaction with my regular bank and I’ve never had this issue. NEVER.",1,2019-03-27 20:37:18
"I opened a Chime account after seeing it was so highly rated. Big mistake. I had $450 deposited into my account. The terms 
say that you can do one transaction before you get your debit card. Not true. I emailed the company to ask why I was not getting my one transaction. They kept sending me the same response that had nothing to do with my question. I tried transferring the money to my PayPal account. I’ve verified the account with PayPal. Chime still would not send my money to me. Or to my PayPal.
I bet I sent them over 10 messages. And then all of the sudden I get an email saying that my account has been closed. With no mention of the $450 that I deposited. If you were looking for a quick alternative to PayPal, this is not the answer. You never get to talk to live person in customer service. What a joke. I wish I knew how to file a complaint with the Better Business Bureau.
I wish that I could post screenshots of the conversations I have had with their “customer service”. What a joke. They’ll take your money (instantly), freeze your account (30 days except they’ll tell you you can have one transaction which isn’t true), then they can close your account for any reason they deem okay. To top it off, you’ll have to wait 30 days to get your money back. (In the form of a check.)",1,2018-12-30 19:21:44
"Having chime since 2016 has provided a lot of first, marriage, children, our own residence. When I became a Chime member I would here from a lot of people using the big box banks not to trust online banking. Casting there doubt aside, Chime has really changed my life. From the ability to have try overdraft protection, which taught me how to budget the expenses that I had and how to save. Then when the 200 dollar over protection kicked in, it allowed me piece of mind to assure all bills were paid, and anything that was needed for my daughters, diaper, milk, could be provided with no worry. My credit was still in the dumps no matter how hard I tried. Then I got the alert about the chime credit card! I started utilizing the credit card to pay household bills and started to see my credit creep up to the point where I would’ve never expected in that short amount of time. Not to mention my pay, which at this time with the economy is the perfect buffer my family needs to feel safe, secure, and independent.",5,2024-10-05 06:31:38
"#whyichime  Let’s say my score was poor not it’s too good for me to even believe. I love open up my credit app to look at my credit score and it’s all because of chime credit builder💰💰and all I did was use my own money to pay my bills and BANG CREDIT GOING UP AND opportunities knocking at my door!! Don’t get me started on chime spot me! Booooy, let me tell you I stopped borrowing from my momma and started borrowing from chime. Going up a level felt like another level with my relationship with chime. I am now at the maximum $200 spot me amount and it sure does come in handy. I have saved so much in overdraft fees I laugh when people say they got a NSF charge from their bank, like chime would never. Chime loves me too much to hurt me like that. Chime wants to see me shine they don’t even charge me ATM fee if I just find an eligible ATM which is almost in every corner in my city! Thank you chime for building me up and not beating me down like all my bills every month! Getting two days sooner really helps a young single mother out!",5,2022-10-07 11:42:46
"I cannot for the life of me figure out how to build credit with this app. I directed deposited over $200, I referred friends got the referral bonus of $100 and everything, finally after a few week I was able to open a credit builder account with a $200 dollar transfer and waited over a month and no credit was reported to any credit Bureau agency, but as soon as I paid my families cell phone bills it reported a low credit balance to the agencies and NOT the on time phone bill pay. And it didn’t report my credit utilization it only reported my low credit credit worthiness of the $10 left in the credit builder account after the phone bill funds were taken out. It did not report the fact that I had a previous credit utilization of 0% on the $200. It’s like you gotta leave the money in the account and never spend it, but if I do that they won’t ever report anything to the agencies. This app is NOT for building credit at all. Thanks for causing a drop in my credit score by decreasing my credit utilization rate, lowering my credit history length and reporting a low credit balance which all work together to show even more bad credit worthiness on my report.",1,2024-01-12 18:23:18
"I’ve been using Chime for at least five years now. And when I say I’m a happy customer I truly am I next to never leave reviews for anything unless they’re bad and I needed to warn somebody to not buy or use whatever product or service they are contemplating. However, chime banking is a smart and safe choice for if you need a primary or secondary bank or just some thing on your phone every day bill pay or honestly even a savings account. They even have a credit building feature if you need to work on your stuff a little bit. I can always get somebody on the phone and for the most part customer service it’s always very helpful polite and respectful. They even have a feature that allows you to be on a queue to be called back in case you don’t have the time to sit around and wait on the phone. There are so many aspects of Chime. I’m not about to sit here and list them all so long story short if you’re thinking about downloading time do you have nothing to lose?",5,2024-04-30 16:37:48
"I mean, overall, I’ve had this, account for good six years, now I just started doing the direct deposit which means I got much more privileges and it’s great but
1 The my pay advance don’t get me wrong. It’s great but every time you check deposits and let’s see you have the consistent $100 but every time you check deposits it drops down to how much you can use per day until it goes back up to that hundred when I really don’t even use it in fact, I’ve used it one time..
2. On that same subject if you do use it, they take the whole thing out your next payday now I’ve also had cash app for probably 10 years when I had the loan they allow you to pay it over four  paychecks., which the great side of that is sometimes people don’t have or Least  would help people because even a cash app. You have the option to pay it off early so if you don’t.
Like I said, I give it four stars because overall it’s great and that spot me that you can get definitely comes in handy, But my  pay advance definitely we could use some work",4,2024-11-17 09:57:41
"You are the worst!  All of you should do yourself a favor and dip out ASAP. I am dealing with a fraud and it is taking more then 60 days for them to complete. Every time I try to get a hold of them they keep telling me 45days on the 47th day and 45days after. Always 45 days. They refuse to return my funds and never have a live representative to talk too. Their Resolution department does not have a phone number and refuses to talk to anyone. Their HORRIBLE. I just went out and got a new bank account. This bank can ruin someone’s life with all the loop holes you have to go through if 1 thing goes wrong. You have no protection on your card and info. Good luck if your trying to speak to someone who speaks proper English. Your dealing with someone else’s money you should know how to talk so they understand. I was also lied too and told by A representative that I would have my money back into my account on November 30. I saw that it was never there so I called back and was told again, 45 days. I will never use them again. I had the case reopen and been waiting with PROOF and all. I refuse to put any money into that account until it’s solved. But I just went out and got another bank account that is much better. Do yourself a favor don’t deal with the hassle and get something that will protect you.",1,2018-12-14 19:40:32
"Chime is only good for simple transactions, in any situation where you are being stolen from, or have fraudulent transactions on your account, chime fails to provide you fair, clear, and thorough research based decisions when it comes to crediting their customers or resolving transactions you would determine or any other bank would determine as fraudulent. Chime consistently denies claims their customers say are fraudulent regardless of how much work or effort the customer personally puts into researching the fraudulent transactions the bank and any other bank would do for their customer. You could have a legal police report regarding your incident of fraud and chime will still deny your claim of fraud and repetitively put you through a cycle of asking for additional documentation in terms of research. The customer facing fraud team can not do much either to help the customer along the way and it ultimately leaves the customer feeling disappointed in the overall management of their funds. They are thieves, and any traditional bank handles and can account for your money far better than chime. As chime is a banking technology app, I’ll also direct some heat at the banks they utilize to house their customers finds horrific experience.",1,2024-09-20 13:50:36
