userName,score,content,at
Chastity Carter,5,"I've been with chime for years. They have always been honest about any fees they take out. which is barely any fees. I get to borrow money without fees. Now, they have credit builder, I'm excited about that. chime is the best. I had don't any problems with them.",2025-04-06 09:22:44
Erin Fauver,5,saved my life. Times are rough. Thank you for making sure I don't have to worry about my money!,2025-04-06 09:20:37
Rafael Rojas,4,well I do like your app the only thing is I really don't get paid 2 days in advance lol I get paid Thursday at 5 pm,2025-04-06 09:19:16
Francisco Alvarez (Paco Alvarez),5,awesome and great,2025-04-06 09:18:26
Jae Elroy,3,"they don't approve disputed when it's clearly fraud. Luckily it'd only happened once, but its concerning",2025-04-06 09:16:11
Mary Sexton,5,"I love Chime !! they have always got me covered, and I don't have no overdraft,, and I build up my money to use when I need it... I Love Chime ❤️",2025-04-06 09:14:15
Charles Kelly,5,Good telephone service,2025-04-06 09:13:11
Manhattan Born,5,I LOVE Chime!,2025-04-06 09:06:45
Phillip Perkins,5,"love chime , helped build credit score and always has my back when it comes to getting my money my way",2025-04-06 08:57:21
PAMELA GRAY,5,great for me when low in money.,2025-04-06 08:53:01
And Justice For All,1,terrible app in order to access your own money they force you to start a bank account with them,2025-04-06 08:43:01
kimberlyholt,5,"never had a single problem with the chime account ,have had less than 50.cents in the back for more than a year go back in to account still there nothing changed .so private and easy to keep up with.i love it.",2025-04-06 08:41:57
Eric Bolyard,4,"So far so good, this app seems to be very easy to use. I have no issues with app. I use to have Netspend but my account got hacked and I lost all my money including my savings. I hope this app is more secure because I can't take a hit like that again. I would recommend this app to friends",2025-04-06 08:34:27
Dwayne Mullinix,5,I love this app,2025-04-06 08:33:02
Shane Collieru,5,best bank app ever better then cash app,2025-04-06 08:31:02
Treka Thomas,5,Love the app! Easy to use. also has fraud alert,2025-04-06 08:27:54
Dominique Bussey,5,"I absolutely love chime. They take care of their customers. I love all the extra features that they have, they have helped me thur a lot of hard times.",2025-04-06 08:25:13
Rayder Medina,5,very convenient easy to use I'll recommended it to anybody I love the app,2025-04-06 08:23:36
Barbara Sanders,5,great!,2025-04-06 08:05:37
Terry Owenby Hughes,4,it takes too long to load to be able to sign in.,2025-04-06 07:48:44
Kyle Brown,5,Love it. Best banking around. Definitely recommended. Simple and easy to use,2025-04-06 07:45:34
Kenya Wade,5,I've been with chime for years and I love it.,2025-04-06 07:40:43
Francisco .Lima,5,great app and great alternative for regular banks works well with other banks accounts as well,2025-04-06 07:23:23
Nicolee Wilson,5,it's a great app,2025-04-06 07:18:47
James Thomas,5,best banking experience I've had. highest recommendation,2025-04-06 06:51:14
MagicalFunnyEdits,5,chime is a great app to use,2025-04-06 06:48:58
Regina Haynes,5,"Between the bonuses and reliable first deposit, Chime has become a serious primary form of holding money. Great Job...",2025-04-06 06:33:23
Allah Sun,5,Official App That I Love ❤️,2025-04-06 06:22:02
Bryan Frazier,5,It's All Love with Chime!,2025-04-06 06:21:18
Angela Purnell,5,this is my first Chime credit card I had to figure it out at first but now I love it,2025-04-06 06:21:12
sean burke,5,"In my book it's worth the while to get involved with, they've delivered their claims, have helped me get my paycheck in advance 💯",2025-04-06 06:12:59
Rayna Daniels,5,this new update is ugly and ridiculous.,2025-04-06 06:12:35
Buffy Hites,5,It's super convenient and easy to deal with. I have been with Chime for yrs n I have no intention of using any other banking application.,2025-04-06 06:01:53
Patricia brown,2,it's ok gotta be careful of ppl taking your funds if your card is not lock from other states. scam but great card to have,2025-04-06 05:58:47
Sherrita Atkinson,5,I love this app and my deposit is about to start soon,2025-04-06 05:49:50
jermayne cook (Mayne),5,the best one you could ever use or choose for mobile banking,2025-04-06 05:45:23
Mary Hubbard,2,trying to set up a direct deposit the app keeps crashing will rate higher when fixed,2025-04-06 05:35:50
Hezery Harlow,5,"chime has good banking, and you can open a savings account",2025-04-06 05:30:07
Mike Godbey,5,love chime never any hassle,2025-04-06 05:03:53
Dale Smith,1,I love chime awesome company,2025-04-06 04:35:28
Luciano Lortz,5,awesome,2025-04-06 04:26:43
BJ Glasgow,5,I really like that I don't get overdraft fees and the spot me. The my pay option is also a plus. I also like the feature that if I minimize the screen it automatically makes me relogin so if someone picks up my phone they won't be able to see any info or have access to my funds.,2025-04-06 04:20:47
Keisha Paige,5,pretty good just one recommendation when you do temporary system clean just notification would help alot before you do it.. since we can't acess our money...inform your user a head of time! other than that I have no complaints,2025-04-06 04:18:21
Paul Humphus,1,kept giving me messed codes,2025-04-06 03:51:32
George Morris,5,it's just 👍,2025-04-06 03:02:27
Summer Marvin,1,"I've been a Chime member for almost 3 years and recently I've had some issues with my account and they customer service agents are rude, not helpful, and have lied about sending the documentation when I first asked. They aren't helping me with a very serious problem and dismiss my concerns without resolving my issue, and try to rush me off the phone. Most of the agents are unable to answer questions due to lack of knowledge on their part. My loyalty with Chime means nothing to them. 0 STARS",2025-04-06 02:57:11
Marquette Wilitstan,4,cool 😎👍,2025-04-06 02:38:00
Wade Braungardt,4,good,2025-04-06 02:33:40
Keesha Wilson,5,Great,2025-04-06 02:24:15
Andrew Hamilton,5,great app,2025-04-06 02:12:09
Pamala Howard,5,l love banking with Chime because this Bank stands behind their customers.,2025-04-06 00:50:50
Osvaldo Lopez,5,it is very helpfurebit.l for everyone thate to bud cil needs a bank account and a part chnca,2025-04-06 00:13:14
Rich Boucher,5,always satisfied,2025-04-05 23:11:18
Sallie Danenberg,5,I use my Chime account as my primary account.,2025-04-05 22:58:23
C Kelly Everett,1,"do not trust these people, they cause devastating havoc, I'm paying for it and now am totally screwed, one person says don't worry all will be back as it was just give it 24 hours and when it wasn't?! I call again insist on a supervisor and get out on hold for 20 sum minutes!? then this jerk tells me the guy the other day telling me all was gonna be back to normal was lying to me!? then the smug creep laughs at me shoots off sarcasticly some generic hogwash and hung up on me!!!!! I reported them",2025-04-05 22:43:00
KASSIE PARVIN,5,no problems love it,2025-04-05 22:29:54
Sean “Ralo” Shields,3,"I've been using chime for about four years now, and it's been great, but now I've been asked to update my app to chime+ and for some reason it will not update.",2025-04-05 22:09:21
Jason Davis,5,it's amazing and I really love the fact that I can entertain myself with this app!! I recommend this app very much!!😁😃,2025-04-05 22:03:21
Phillip Sheppard,5,best bank ever,2025-04-05 21:26:34
AoneSick DaBiz,5,best card I have,2025-04-05 20:57:21
RubyAnn Bray,5,the boosts are so helpful & the spot me comes in the clutch!,2025-04-05 20:14:45
sharon wickham,5,"could not say enough great things about Chime, I recommend it to anyone who will listen",2025-04-05 20:07:25
Patty Harrison,5,love love love chime,2025-04-05 20:05:45
Tony Brown,5,Great service,2025-04-05 19:41:12
Nathan W.,5,"5 years I've had chime they have kept me from going under so many times. Thanks, Chime. I'de avoid the mobile check deposities, tho if ya can, they get weird there.",2025-04-05 19:41:01
Kate Hornyak,5,"fast and easy, love that i can over draw without penalties. also love the easy money transfers, my family all have chime as well so we can securely send money to each other.",2025-04-05 19:34:36
Daniel Hudson,5,"No overdraft fees ever ...... with my pay, spot me, and boosts, Chime always makes sure you are covered. Chime is truly banking that cares about their customers. 🤑🤑🤑🤑🤑",2025-04-05 19:32:56
Kieth Armstrong,5,need help .on my card ty,2025-04-05 19:30:29
Dwight Nichols,5,it's really okay 👍,2025-04-05 19:27:06
Robert Albor,5,great,2025-04-05 19:18:59
Donald Anthony,4,I like chime to send money to friends and family with no issues the only thing I don't like recharge 395 just to put money on your account then you guys also charge me if I use the ATM that's the only downfall instead of cost me only a couple bucks for the ATM and costs me over $5 something 6 bucks or more it's crazy that I get charged from you in the ATM I like time a lot,2025-04-05 18:37:53
Cheech Estrada,5,Best bank ever!!!!!!!!!!!!!!!!,2025-04-05 18:24:23
Will Brown,5,"chime is a great alternative banking solution and is always there when I need it most. I save a lot of money by avoiding surcharges, overdrafts and etc.",2025-04-05 17:59:00
Dana Douglas,5,Love Chime! absolute best.,2025-04-05 17:51:37
Brenden Rogalski,5,good app does what j need,2025-04-05 17:44:05
John,5,Been with Chime for awhile and can't complain. Great service.,2025-04-05 17:42:20
Kenneth Johnsey,3,ít can't tell me why théy cànt download chime app,2025-04-05 17:39:04
Andrea Serna,5,I have really enjoyed using these services . I don't really like banking so I had NetSpend for 10 yrs and boy this is way better. thank you 💖,2025-04-05 17:23:57
Lieren Cavanaugh,5,"I've only had it for a short time, and it's already better than my last online bank. I do wish I wasn't getting bugged to use all the features available. I want to keep things simple.",2025-04-05 17:05:19
Chris Graham,5,"Chime provides such a great benefit to so many people. They provide extremely useful services for their customers like interest and fee free payday advances and small overdraft loans; send money to anyone - Cash App, Venmo, Your sister in Alabama, etc., Credit Builder and more. These things are all extremely useful and create huge value; at least that's how I see it. Great bank!",2025-04-05 17:03:45
Steve Nuss,5,100 percent good to go !!!,2025-04-05 16:55:12
Lejawn Celestine,4,Love it,2025-04-05 16:42:54
FELIX HERNANDEZ,5,Love it!!! MyPay and SpotMe features are amazing!!!,2025-04-05 16:36:32
Jermaine Richardson,5,"they work with you"" especially you need alerts to remind you there here.""",2025-04-05 16:28:59
Peggy Surrisi,5,I love getting my pay earlier and the money I can borrow without having to pay a high interest or fees.,2025-04-05 16:26:20
Sharon Davis,2,pleae take the Chime plus off my app and restore itback to the originl app.,2025-04-05 15:49:15
George Martin,2,"i just need a credit card with like $1500.00. i DON'T need direct deposit, i don't do paypal, and i dont need to transfer funds to it. i just need to make a charge, and pay the bill in payments. is there any way to skip through the features that i don't want?",2025-04-05 15:48:01
Rainbpw,5,easy banking money,2025-04-05 15:45:09
Matthew Harper,5,good,2025-04-05 15:37:04
Paul Stempeck,5,Great banking,2025-04-05 15:30:13
Robert Olejniczak,5,I love chime and all they offer. free overdraft and loans till payday. Early check deposited. Best bank I've ever dealt with. thank you Chime,2025-04-05 15:20:54
Armado Rodriguez,5,good,2025-04-05 15:19:43
James Shrum (Tidbit),4,authentic one of my favorite friend in my life,2025-04-05 15:15:23
Pamela Martin,5,I think it's great!!! helpful for life's ups and downs. really appreciate chime. building my credit. never could of did it without them.,2025-04-05 15:10:48
mike huntswet,1,"Rip-off, and a scam. I put money into this app, now I cannot do anything with the money. Cannot activate, or use their fake debit, and credit cards. Called customer service, and the app mysteriously would not work, during the call. No way for me to access my money. Avoid this app at all costs. It is a scam, and you will lose whatever you put into it.",2025-04-05 15:10:33
Linda Montenegro,5,I've tried others Chime is the Best 👌,2025-04-05 15:04:11
Felicia Young,5,love chime,2025-04-05 14:58:52
Teresa Loadholt,5,I just love chime it's my everything that I need,2025-04-05 14:41:18
Ashley Daniels,5,I hate chime it works when it wants to its always going down I have had this card for over three years I wish it still worked how it did when I first started,2025-04-05 14:40:25
sandra sierra,1,my mom has passed they sent a letter saying my new lawyer and I are not entitled to the funds . but the thing is I'm on social security and my check was in that account as my mom was my payee . the checks were supposed to be returned to the social security Treasury and I can't get in contact with a human being in this . do not down load this app .,2025-04-05 14:39:36
Bob Duval,5,Chime is easy to use. It is simple and straightforward and very convenient. App is very simple and does everything I need without all the bulls#$$ that no one really needs!,2025-04-05 14:33:34
Heidi Minor (Mooneyes21),5,"They are the best. They helped me build my credit score from a 003 to a 650+ in a little over a year. Yes, I did mess that up and went back down some, but I have brought it back up. Now I don't like talking to the bot or the people who you text to figure out problems you may have, so I call and speak with a human, and they always help me understand the who, when, or why. And if there are charges I didn't make, they quickly refund the money back into my account.",2025-04-05 14:28:36
Arlene Rivera,5,love chime wish they had a higher spot me for me,2025-04-05 14:16:47
amber quinn,5,I get my check two days early. the spot me and the my pay helps when I need money after paying my bills. best bank app out there.,2025-04-05 14:16:07
Tanya Dillard,1,"will never use this again my hubby used after my bro had a very bad expierence we were scammed 170$ we put the request in for fraud and refund we were told it would be 3-7 days here we are a month and 1/2 later no item, no refund NO CONTACT OR RESPONSES FROM CHIME",2025-04-05 14:12:58
Mario Lovrinic,5,"A++ experience and not one complaint. Excellent banking experience and the app is user friendly. The ""spot me"" feature has saved me a few times and is such a nice alternative to fall back on when needed. Plus I get paid a day or two earlier every week. Thank you Chime!",2025-04-05 14:12:57
Lewis Shahan,5,since I've joined n9t a single issue,2025-04-05 14:10:11
Kirt East,4,Chime has totally changed my banking experience. 10/10 recommend to people always on the go who don't want to have to make plans for bank trips. The credit builder card is a very great way to build your credit as well.,2025-04-05 14:06:13
Urial Barshell,5,nice app,2025-04-05 14:05:32
Ten Toes Gaming,5,way better than a traditional bank,2025-04-05 14:05:05
Leeanna Moreno,5,easy to use. love my chime cards,2025-04-05 14:03:41
Katherine Williamson,5,I'm going to relley Like this one because it's so easy,2025-04-05 13:30:47
Damien Downie,5,"I'm loving chime it's a really easy way to build my credit as well as save money and everything is right at my fingertips. with that being said I only have one request and that's to be able to hide what you have in savings from the home screen while still having the ""savings"" button option as selectable from the home screen that way I can put money in and not be able to see money that I don't have to spend",2025-04-05 13:29:41
Amy Jaroszewski,5,I have finally found the best account,2025-04-05 13:20:59
Teresa Jacks,5,"they're always there to help you whenever you need something and you don't have to leave you're house to receive there help ..,",2025-04-05 13:19:29
Katherine Herbert,5,if are very good os Great includes account voice and figuring house now what,2025-04-05 13:13:37
YostII,5,Helped me with the opportunity in rebuilding my financial freedom. Excellent customer service representatives.,2025-04-05 13:10:29
Steph Scott,5,Been with them for a minute. if I had issues customer service chimed in with the answer. (catch that 🤭) I'm satisfied and me being a responsible adult....if I'm not i would have dropped it by now. Thriving and chiming over here 🫰🏾🤑🎶,2025-04-05 13:10:27
DIANNA ROASTING STICK,5,it's about time for a good time 😉,2025-04-05 12:47:54
Melissa Nelson,5,I love using you guys and how you lend us money until payday,2025-04-05 12:38:09
Christopher Warren,1,I SAID BE ABLE TO KEEP MY SPOT ME MONEY EVEN IF I HAD NOT DEPOSITED OVER $200. BE BETTER THAN OTHERS KEEP CUSTOMERS HAPPY,2025-04-05 12:30:12
BlackFloral,5,"Besides a few hiccups occasionally with direct deposits, the application is pretty good for banking standards. The only bug I've encountered was when transferring from another account, the button will freeze. Other than that, the new design is very modern and vibing.",2025-04-05 12:27:13
Richard Sahagun Sr.,5,Had my ups & downs with Banks. I just wanted to share with everyone else Chime Bank is where we settled down. Couldn't be any more founded on solid ground. Thanks Again Chime Bank,2025-04-05 12:19:59
Joushua Plummer craft,5,its awsome,2025-04-05 12:07:32
Nikki Christy landing,5,love it💕,2025-04-05 12:06:18
J Deniro1,5,CHIME 4 THE WIN!!!!,2025-04-05 12:04:02
BryAC,5,chime has been nothing but good to me.i don't like saying this but If I didn't have chime there would have been days I wouldn't have been able.to eat or pay a bill with there spot me and payday advance .I'm able to get through the next 2 weeks till payday..Love CHIME!!,2025-04-05 12:00:19
Stephanie Dixon,5,love the App.,2025-04-05 11:57:34
aline rider,5,I like them better. I do a checking account in a bank,2025-04-05 11:46:12
Nick m,5,"everything about this app is great, my paychecks are never late, they're always there if I'm short or need some extra emergency cash. recommend to everyone I know!",2025-04-05 11:44:29
Mike Bethel,5,I like this app,2025-04-05 11:38:59
Tea Tea,5,love it easy to use,2025-04-05 11:38:10
Timothy “Timbob” Strickland,5,Chime banking is awesome. I love this app and the Chime support,2025-04-05 11:32:46
Loren Buckner,4,Great application. Easy to use. Just wish it had an option to also include a postal mailing address for those of use who live in rural areas with spotty mail coverage.,2025-04-05 11:32:39
William Breckheimer,5,love it,2025-04-05 11:27:34
Joseph Brandon Martinez,3,can't get,2025-04-05 11:25:58
Kelli Manfrina,3,having a hard time getting my $$ from the bank to the credit card 💳,2025-04-05 11:18:28
Mike Culver,5,love Chime.,2025-04-05 11:14:59
Lisa,5,Love Loveee Chime. I'm staying 😁,2025-04-05 11:11:20
Shirley Mathis,5,I love chime,2025-04-05 11:08:15
Derek Richards,5,chime is really good,2025-04-05 11:04:24
Billy Heaton,5,I had a lot of cards before I got chime but chime is the best of any of them it's only one I'll ever need the rest of my life.And you can take that to the bank.,2025-04-05 10:52:05
Ryan Frechette,5,great so far. waiting to see if the credit builder card actually works!!,2025-04-05 10:48:26
youug Willie,5,"Fast ,Honest, Fast and Great",2025-04-05 10:45:50
Dani Douglas,5,I LOVE CHIME!,2025-04-05 10:44:04
Shy Smoov,5,👍🏽✨️,2025-04-05 10:42:08
Chicka Jones,2,"Not for a main bank ofc , not for transactions you need to keep track of(if u get a rental screen shot the date because chime won't have it neither will you statement ) , not for fighting for you(not getting the ur money back ) , Not for making important transactions unless u screenshot for our own trail . Holding money good , deposits good .",2025-04-05 10:36:08
Amy Hudson,5,easy,2025-04-05 10:30:23
A P,5,"I love CHIME, and its user friendly app.",2025-04-05 10:17:54
Josh Hoover,5,"So far, Chime has been the perfect online bank for me! I have been using them for 5 years now. I used the Chime credit builder, and in 2 years, my credit score went from 400-700! It's easy to use, and I highly recommend it!",2025-04-05 10:17:30
Clinton Showalter,5,THE BEST banking app!,2025-04-05 10:17:01
engle Dalton,5,love it!!!,2025-04-05 10:15:51
Randolph Young,5,great service,2025-04-05 10:08:29
Joel Neer,4,I love chime. so helpful when i need extra money,2025-04-05 10:02:40
Katina Swearengin,5,"I love Chime. Best banking app ever. I use to waste so much In bank overdraft fees. Now, not only do I not pay fees, but Chime will actually lend me money out of my upcoming paycheck. As long as u have a job, Chime is perfect.",2025-04-05 10:00:56
D Leigh,3,"I love Chime but now says I can't UPDATE because my device is no longer compatible . I am NOT Buying a New phone and VERY DISAPPOINTED, most likely will be removing this app from my phone since I cannot update it. I'm using an older android phone. I'm on a tight budget. This needs to be addressed ASAP",2025-04-05 09:59:39
barbara sharer,5,I enjoy the app alot and it's easy to use,2025-04-05 09:57:24
David Ambroz,5,I love chime.Never had any issue's. starting using the credit builder card with no credit. It works credit score is up to 650 now..Highly recommend chime..,2025-04-05 09:56:21
Shawana Hubbard,5,"I love everything about chime, there professional and dependable",2025-04-05 09:54:47
Billi Acord,5,I love it,2025-04-05 09:44:38
James t Fuller jr,4,I love it,2025-04-05 09:38:55
Eloy garcia,4,I get paid 2 days early and the boost. And the boost that my friends and I are able to give One another. So we could borrow more money if needed. Till our next paycheck is awesome.,2025-04-05 09:36:35
Vanessa Johnson,5,I would recommend Chime to every one...,2025-04-05 09:31:23
John Ironnecklace,5,this is a very good app,2025-04-05 09:30:48
Gina Collins,1,I have had my chime account for 3 years and am now a chime+ customer. They have great benefits but will not protect your money like major banks. I disputed transaction 2 times. They did credit my account but after the investigation they sided with the merchant that I cancelled the subscription with. Well after almost a year of going through this that same merchant is still trying to take money out of my account.,2025-04-05 09:30:43
Edmond Williamson,5,Fast and to the point,2025-04-05 09:25:28
Gherman Michael Clusan,5,AWESOME!!!,2025-04-05 09:25:26
Marsha Cox,4,love my chime card,2025-04-05 09:22:32
Heather Sprouse,5,I've used Chime for 5 years. I've built a credit score and during hard times being able to overdraw without fees has saved my life.,2025-04-05 08:57:29
Tanya Rideout,5,I love chime. My deposits are always on time and customer service is always on point.,2025-04-05 08:56:59
Doom Guys,5,great and easy way to keep an eye on your money and manage it quickly too.,2025-04-05 08:50:24
darlene bennett,5,love chime. better than the banks,2025-04-05 08:50:13
C Childress,5,luv chime and get paid 2 days early!,2025-04-05 08:42:25
Gage Rowe,5,I'm 35 years old and have no credit history. Thanks to Chime for creating the credit builder. I'm just getting started but it makes it easy enough that everyone can do it. Hoping that the credit builder will eventually grant me a loan to buy a home for my family.,2025-04-05 08:41:38
Claudia Smith,4,I just wish there was a way turn off the my pay advance feature,2025-04-05 08:40:27
Andrew Cox,5,builds your cretid and no fees,2025-04-05 08:39:34
CLIFFORD OLIVER,5,Very efficient and accurate,2025-04-05 08:16:39
tanya frazier,1,I think chime should do better with the spot me. I haven't had a increase in years,2025-04-05 08:14:53
Etta Reed,5,my account is still pending over a Google account I had no aware of.,2025-04-05 08:13:38
Willis Burnett (Smoothdafinessa),5,Great banking,2025-04-05 08:09:55
Antone Alchesay,5,chime has never let me down. comes in handy alot. would recommend 10/10.,2025-04-05 08:03:01
Fernando Rosales,5,"great for everyday use, being able to have a card is like being privileged, I can't explain it.",2025-04-05 08:01:00
Maribel Ortiz Soler,5,Simply the best banking experience.,2025-04-05 07:56:40
Mikeal m,5,my favorite banking app,2025-04-05 07:56:26
Todd Tibies,5,awesome 👍,2025-04-05 07:48:44
Iasha Phillips,4,i want to be able to lock my card an not just the virtual card,2025-04-05 07:33:51
Lajuna Dickinson,5,awesome,2025-04-05 07:29:42
Christopher Oppocher,3,log in can be difficult,2025-04-05 07:24:56
ismail hakim,5,GREAT AND LOVE IT,2025-04-05 07:18:19
Dale Coston Jr,5,very user friendly,2025-04-05 07:18:02
Time rizer Rizer,4,great for building credit,2025-04-05 07:15:08
Jorge Delara,5,OUTSTANDING!,2025-04-05 07:06:16
Kel,5,no minimum deposits,2025-04-05 07:01:42
Dean Malone,5,Real easy to navigate through. No hidden fees or charges.,2025-04-05 07:01:07
Jesse Hayes,5,best banking app ever,2025-04-05 06:54:12
David Vaughan,5,well I my chine even though when I was sick and I miss work for 6 weeks they started my credit line back to zero not fair,2025-04-05 06:52:08
Michael Johnson,5,I think Chime is a financial partner.,2025-04-05 06:48:46
R. E. Hankins,5,excellent banking in all aspects provided...!!!,2025-04-05 06:47:01
Barry Porter,4,"I love the service. But I just have one suggestion. If my card is frozen, merchants shouldn't be able to change me Even if I've been making payments to them. Sometimes I don't have the money to pay on that day.",2025-04-05 06:40:45
Kevin,5,love it,2025-04-05 06:34:03
Staci Tyler,5,I absolutely love this bank!,2025-04-05 06:32:34
Lacey Trumble,5,great,2025-04-05 06:23:23
Brian Markley,5,awesome online banking,2025-04-05 06:22:17
Joseph Wright,5,Best Banking App by far !!!,2025-04-05 06:20:48
