review,rating,date
"Chime has been a huge help for me for the past 5-6ish years I believe. I’ve been using them for a while with direct deposit. They are massive help when you are in a tough spot. Not only do they have the Spot Me fee free feature, they have also came out with the My Pay feature, allowing you to borrow a lump sum of your paycheck before pay day! Fee free! You of course have to build up your limit that you are allowed, but nevertheless it is a massive help in tough spot. It’s absolutely worth building. It did not take me long to max out at all. Another worthy note, you can boost friends in order to raise your Spot Me even higher. It’s such a great way to mobile bank, and I highly recommend it if you’re looking into mobile banking. Although there are some features you won’t get like you would a regular banking account (minimal, such as bigger loans), and VERY RARELY do I come across certain places I cannot use Chime for (because these places do not support it currently) but it’s still definitely worth using in my opinion. There is always hope for future improvements of course. ☺️I will continue to use Chime, and it will be recommended to anyone that may need it or who are searching. Thank you for having mine and millions of others back, Chime! 😁😁a fat 5 stars for you.",5,2025-03-04 12:44:40
"Chime is just what you would expect out of a bank. You can open a checking and savings account just as you would with any other banking service. One of the main things that stand out to me over other banks is their app UI, it’s very simple and clean, making it easy to find what your looking for. I absolutely hate that most bank apps have so much stuff on their UI that you can forget where things are. Chime keeps everything neat by keeping what’s important easy to see and the rest of it under the settings. The SpotMe feature kind of feels like a gimmick. I thought it was cool at first but the main problem with it is that they are turning overwithdrawals into a “I got your back” feature; almost as if they are encouraging it. The only difference with the SpotMe feature is that you will not be charged a fee for doing so. I personally think it’s a bad idea because this feature can encourage bad financial decisions, especially because they offer boosts that increases the amount you can overwithdraw. It’s a nice feature to have when your struggling but it shouldn’t be encouraged. Also, one of the downsides to it is that you can only use the SpotMe for online purchases but not for paying bills which begs the question, “is this really to help you or is it to encourage spending over your balance for things you want?”. Aside from this feature it’s a pretty good making service.",4,2022-10-16 19:06:17
"I like Chime for the most part besides the overdraft limit comes in day by day so if you get $500 over draft you technically only get like so much of that overdraft daily starting out it’s like $25 I been with Chime now for over a year and just now getting $50 a day overdraft limit it’s just ridiculous. Especially when you need to pay a bill or get groceries. Rather than that easy to use. I didn’t like a big
Money transaction amount of a dispute that was wrongfully charged for a car that was even fixed Chime denied my dispute when I sent in screenshots of text messages receipts documents thru emails pics and videos for evidence and proof I just paid for services that the car place did not fix at all. I even ask them to give me my money back before contacting my bank they said no that they would have a mechanic take a look at it. They lied about test driving it too I didn’t get 2 miles down the road before my engine shot to overheating out of nowhere and almost cause even more damage’s to my vehicle luckily I acted quickly and had to sit for an hour two miles down from the shop to wait for them to bring a tow truck right down the road to bring it back. So future
Reference Chime dispute team my claim of my dispute was black and white with all the proof so the fact my bank who holds my money should protect my money at all cost especially for something that is straight up crooked and that didn’t receive services that I had paid for!",3,2025-02-05 10:43:53
"I recommend this app to people all the time, but suddenly disqualifying me from SpotMe because I had a couple light checks and just keeping my money has got to go. There shouldn’t be any qualifying conditions other than receiving a direct deposit OF ANY AMOUNT. Why does two paychecks of $197 mean I’m less trustworthy than someone who’s had two paychecks of $201? $4 is the difference between whether or not you’re certain you’ll get your money? If I get no direct deposits for a while, yeah, sure, do that; but if I’m getting direct deposits of like $180, I’m pretty sure that means I can get you back your little $20. How about you just look at monthly income, if you’re gonna look at anything at all? Demanding every single direct deposit be at least $200 is ludicrous and insane, and it’s gonna run you out of business. Your credit builder card is an awesome service, and you’re absolutely my go-to for banking— don’t ruin that. You put me in a really difficult position by disqualifying me with no warning— and before you say “you knew the limit”, there are no provided guidelines on how many times you can fall below $200; also, I get paid weekly buster. If my checks were biweekly, I’d qualify, which is just another failing of your qualification system. Take a tip from CashApp, before you start hemorrhaging customers to the competition. No qualifications. Debt collectors exist for a reason.",4,2024-12-07 16:55:46
"Perfectly reasonable and useful app and service. I've used this service for 2 years and rarely see bugs or glitches in the app. Typically my paycheck is deposited on the same day that it is processed by my payroll (2 days before traditional banks). There is no option for joint accounts at this time, but it's very easy to move money to or from another Chime user. The credit builder service is excellent, particularly when used in ""safe"" mode. The app allows you to set out a portion of each deposit for Credit Builder and Savings automatically, which makes setting up auto-pay super easy for recurring bills. Spot me is a nice plus for the occasional overdraft, and the MyPay loan option is useful for tight weeks as long as you budget appropriately around paying it back. Mobile check deposit is easy to use and typically processes quickly (often same-day) unlike other banking apps I have used. 

I deducted one star due to the fact that a not-insignificant amount of other money/budgeting services do not work well with Stride bank, but that is not a reflection of the app. 

Overall, I would recommend this app to people who either do not have any mingled finances but do frequently send money to friends/family and to those who have mingled-but-not-merged finances as it allows easy transfer between users (and non-users) while maintaining an individual account.",4,2024-09-20 13:33:06
"For me, Chime has been the best bank I have ever had. Offering overdraft protection without fees, leaving me the option to tip has been a game changer. I can’t say how much I appreciate this feature. The customer service is pretty good. They usually get in touch in a timely manner. Again, I appreciate this as well. There have been times that were my mistake. Like a lost debit card. They provided a way for me to still have access to my funds while I waited for my new card. To my knowledge, I think they went above and beyond by not charging for the extra card and sending me my new card quickly-within a few days. The only thing that has changed for me is payday. My payday through employer is Friday but I get paid two days early until recently. It is now only 1 day early. At the time I had all my bills set for the Wednesday so it was a little bit of a mess. I have learned my lesson the hard way. My response was they don’t hold our pay. So I’m not sure why this has happened. I don’t like it but it is what it is. It may seem trivial to some so that’s it in a nutshell. Overall they are great-customer service is good. No fees is for real. Boost. Overdraft protection. If someone signs up from your referral you both get money. That’s amazing . Thank you!!",5,2023-09-15 10:43:01
I downloaded chime to use as a secondary bank account to save money for my wedding next year but still have it easily accessible for when we need to use for things like deposits. Thinking in could just transfer the money from my main account (with Northwest bank) into my chime checking account and use the debit card when needed. Wrong! I liked that I could use my debit card from my original account to transfer money instantly. Well I only realized after my first transfer that there was a $200 monthly limit on this AND it was only available for the first few months of my Chime account being opened before it wasn’t an option at all. Annoying but I can just do a bank to bank transfer which will take a few days but I’m patient I can wait. Turns out Chime has an error with my personal bank AND the joint account I have with my fiancé through Citizens Bank. 😑 which means the ONLY way to get money into this account it to set up my direct deposit through work which I am not going to do as it’s not my main account. I should have known that something was off when they pushed SO HARD for me to set up direct deposit during the initial set up process and I’m sure it was in the fine print somewhere but it was definitely misleading. I assume since Chime is free they get some kind of money when people set up direct deposit with them but I do not feel like it was made clear that the whole account would totally useless unless you use direct deposit with them.,1,2024-04-10 11:48:35
"I have been using Chime for my payroll direct deposit for many years. I have always received my paycheck 2 days early. I really love the Spot Me option, where you can go negative up to a certain amount & Chime will cover you with no fees! You can also send up to 4 other Chime users a $5 “boost” & when you receive one back, you get an extra $5 of Spot Me (up to $20 extra in Spot Me per month). You can send money to anyone with or without a Chime account with no fees by using the “Pay Anyone” feature. The recipient receives an email containing a link where they enter their card details & the funds are instantly available! Chime also offers an Instant Loan, which you pay back in monthly installments. Chime also offers “My Pay”, where you can get up to $500 of your paycheck early & you just pay it back with your next direct deposit. The only downfall to My Pay is you are not able to access the entire $500 at one time. Each day, you are able to request a small amount to be deposited into your Chime Checking Account. My Pay does charge a $2 instant fee, which you pay with your next deposit. They do offer a free option, but can take 2-3 days to be deposited into your account. Overall, I highly recommend Chime as an online bank! I just wish they would allow larger My Pay deposits.",4,2025-03-18 17:55:50
I banked with Wells Fargo before which stole money from me and gave me fees that I didn’t know about they really killed my trust in banks but then I heard about chime and even though I was scared I tried it anyways because I was starting a new job and didn’t want my checks deposited into Wells Fargo so I with faith downloaded chime about 2 years ago and I can say they I trust them the most I love that they have a credit card to build your credit but they only take the money you put in like a debit card they also have an over draft safety net and you can send an extra 5$ boost to other people and they can do the same for you and if you share chime there is a sign on bonus as well I couldn’t think of a better bank it is completely built for the people with no fees and makes it super easy to build your credit and I’m a college student who graduates soon I would like to buy a house so I need to raise my credit score so I pay my phone bill and sometimes tuition payments with my chime credit builder snd minute purchases as well like dollar tree they all count no matter how big or small If your thinking about trying chime MAKE THE JUMP. You have nothing to lose from a former person who didn’t trust banks they have restored my trust and given me many opportunities,5,2022-10-14 14:54:55
"I’ve been using Chime for years. It gives me great pleasure to pat them on the back and say, “Chime is the #1 online banking app/resource out here, hands down no other is as worthy of this pat.” Over the years of being a Chime member, I have not had one conflict or account issue whatsoever. I truly mean this. Chime has built in programs that are centered around any members association as smooth and stress free, period. Chime also opens opportunities for members with a boat load of perks and incentives. As a matter of fact, Chimes “Spot me” has saved me, helped me, and, assisted me in tough times. I’m not payed to share this with you. I’m telling you what I know and I have been using Chime for quite some time. Do yourself’s a favor. Sign up and tell me if I”m wrong. Word of caution, you won’t be able to because you will appreciate it just as I have for all these years. Thank you to whoever introduced chime to the public, you really make a difference and impact lives. Lastly, chime helps boost your credit score as well. They have features that you can utilize say in paying your phone bill, utilities, mortgage, you name it. Chime verifies it and reports it to all three credit bureau's. You get the benefit of watching your score grow, in real time! Chime is in a class all by itself!!",5,2024-06-03 00:11:20
"i switched to chime because simple bank became bbva. getting my paycheck a couple days early and not being able to overdraft were what drew me. the credit builder account was a surprise to me and i love it. i have poor credit and this is such an easy way to build credit. 

the BEST part of the app for me though is that when i get paid it direct deposits to my credit builder account and i have all my bills taken out of that. so when i get paid i look at what will need to be paid that paycheck and i put fun money in my spending account. it’s a lifesaver if you’re prone to dip into bill money. if you overdraft on your spending account, spot me will cover it up to $20 off the bat (tried and true, my friends), and it WILL NOT pull from credit builder or savings. because i live paycheck to paycheck i don’t really have a savings account, but i do use their round-up feature. you’ll be surprised how quickly you save with it. it’s really helping me get my financial situation together. 

it can be really hard to find a bank or budgeting app that works well for people who live paycheck to paycheck (makes me feel so dumb that i can’t budget for a whole month), but CHIME IS IT FOR ME. Seriously, give them a chance. Customer service is great, too.",5,2021-04-14 18:57:36
"I got my tax return check and tried to deposit it through the Chime App. They ask you to write to deposit to time only on the back of the check. I did so and then took pictures of it front and back clear as day and they rejected my check not once but twice. After calling in speaking with a representative twice they were unable to tell me why my check was rejected. I then called back on Monday and asked to speak with a supervisor who told me that they did not have the access to tell me why my check was rejected that I needed to email the chime support. After emailing the Chime support I was told that they could not tell me why my check was rejected. So now I’m stuck with a check that says to deposit of chime only on it and cannot deposit it with chime or anywhere else. They have ruined my check and failed to give a single reason of why. This banking app clearly does not care about their customers or their money. I will be sure to empty my account with them and delete it. Never will I use chime or suggest anyone to use them ever again. I even asked them where to file a complaint and they will not get back to me, so I leave this review instead in hopes other people won’t take a chance with their own checks and have the same issue as me.",4,2022-05-16 14:40:41
I’ve been with a lot of banks and I’ve never had somebody tell me that I’m not able to cancel my cards based on me not knowing the last settled transaction. I recently had my cell phone and wallet stolen so naturally I called to cancel my cards and the customer service guy said that I couldn’t cancel my cards even though I gave him every piece of information you could think of Social Security name etc. except I didn’t know that last settled transaction naturally having my phone which is basically my computer and my cards stolen . To make matters worse I couldn’t even understand what the guy was saying he sounded like he was hung over or some thing but he basically said that I couldn’t cancel my cards and I just have to let them linger and let them get fraudulent charges charged to them which is exactly what happened. Once I got my phone in the mail I was able to download the app and cancel them I also noticed all the fraudulent charges that happened during the time I was not able to cancel my cards and they haven’t refunded me for any of them .I emailed them and called multiple times and it’s just mine blowing that I wasn’t able to cancel my cards and that the guy on the phone was so inconsiderate and unhelpful there Hass to be a solution I said but apparently not . other than this experience they’ve been pretty good so if you’re a clumsy like me and lose your stuff I would think twice about this place.,2,2022-01-24 02:39:29
"I have been with Chime for quite some time now and let me tell ya, when I say they are amazing... THEY ARE AMAZING!! I was with a Credit Union for a little while and they told me I was set up with an account that I couldn’t over draft in... yet every payday I was magically some odd amount in the negative. It NEVER failed! Then, I decided to give Chime a chance and see what happened. NOT ONLY do they not charge fees but they have this really cool setting that makes it SUPER easy to
save called “Round Up” and basically what that does is every time you add money to your account it saves a percentage of that amount. Which is BEYOND helpful. It does the same when you spend money as well, except, it rounds up to the next dollar amount I believe.  Their customer support via Phone/Email is FANTASTIC! The workers are so sweet and helpful and anytime I’ve had to call they fixed what ever I needed! I’ve only had to call them twice and neither were to complain but to figure out something or get an answer to a question I didn’t know. 

I’m not gonna lie, at first I thought it was a scam, or just another ad on FB... but I am honestly SO happy that I switched. If it wasn’t for them my taxes would’ve already been fully spent and most of it in fees 😂 I HIGHLY recommend dumping your physical bank and joining Chime. It’s worth it... I PROMISE!!",5,2020-03-12 07:44:22
"Have accounts with most major banks and Chime has by far been my favorite. Much more convenient, accessible and easy to use. Specifically, Chimes secured credit card (using your OWN money and thus can’t spend more than you have) has raised my credit score about 25 points since I started using it about 1.5-2 years ago. The app itself is very helpful and easy to navigate, especially compared to Chase or BoA. Features such as bill payment, instant savings transfers, credit builder, “Spot Me,” easy ATM access, and direct deposit are great options. Depending on your employer, you may also have the opportunity to get your paycheck 2 days earlier than normal. 

The downsides are very minimal; No checks are issued (some jobs require a voided check for DD), there’s no physical location (it is an online banking app after all) and their customer support isn’t great but I’ve rarely needed to call them.

Overall, Chime is a great online banking app and it’s helped me build my credit back up. Even if you already have a bank account with a larger bank, I would still recommend having Chime just in case. ALSO, if you’re a parent, this app (along with the secured credit builder card) is an amazing way to start building your child’s credit.",5,2023-07-19 03:56:04
"I’ve had chime for over a year and loved it. However here lately on “pay day” I have sat all day waiting my check to deposit. Sometimes it comes as early as 11am. Others as late at 5pm. Unfortunately today my chime is unable to track my deposit and it’s not listed under “on its way”. 
Once I have gotten it at as late as 12am which means only 1 day early and that is fine but what is inconvenient is how inaccurate the time slots are and have been for arrival of and now not being able to track my deposit throws me back. A lot of other banks do not associate with online banks. Meaning if someone tried to send money from a credit union to your account for chime. It won’t work. You can not go directly deposit a  personal check yourself. You have to go to a gas station and jump through hoops. Chime doesn’t offer loans or grants like real banks. I suggest this for teens who are just starting out however as you age and get a career you shouldn’t use chime do to all the faults snd it being unreliable. Credit builder is nice but you only build credit. There is no interest with a savings,banking, or credit account as real banks offer. The spot me feature is also nice. However it tends to come and go and only allow access when it wants. 
Planning to switch banks again bc they also do not file disputes as I have had to do over ATM transactions. I still haven’t gotten my money back from this and it happened in April of 2021",2,2021-11-17 21:02:43
"So I’ve had time I think for roughly around 2 years now as a second bank and man, they are so awesome! Truly and I think this is the first review I’ve ever left on an app in my life🤣. And I also bank with navy federal, and I have always been under the impression and still feel to some degree that is the best bank you can have as far as a traditional bank goes because they are fee free and you can get great loans and great discounts but obviously you have to be ex military or have a close family member who is military. Chime I feel is changing the game of banking and just to see the growth and new measures and features they put into the bank and the app itself within these past two years really shows that this bank has a big future, and will change banking forever. I think they will be doing loans as well in the future but for some reason the only bad thing about this bank is that if you try to get a loan through a company, they will not work with you if you use your chime bank, and a few other institutions out there look at Chime as if it’s one big scam witches truly unfortunate. But I still give it five stars. Because it’s not their fault I’m sure that these a holes look at Chime the way they do and don’t want to work with them.",5,2024-12-05 19:19:58
"I have never worked w a better online bank than Chime! IT’s security is Top Notch!! I had a company that I have never visited knew nothing about try to take out a payment from my card. It over 100 payment and Chime Notified me immediately! They texted my number and asked me if I had approved that purchase! It was a simple solution: “reply yes or no.” I replied:” No” of course & they wouldn’t allow the company to withdraw the money out of my account, and for that I am very grateful. You have an option to go over on ur account as well and pay it back later! I’ve had to use that a few times. I strongly recommend tipping chime so that feature stays available and in tact! The credit builder card is Amazing it works for itself helping with providing you a credit score you can be proud of! There are no unexpected fees they try charge you!  I have no complaints when it comes to chime! I love it! However, I wish there were more ways to talk to someone w chime or when a person does try to order something using ur number other than u if chime  would offer more details about the transaction purchase and company it was purchased from. That’s the only thing I can think of that could use some work! Keep up the great work chime!!",5,2023-03-18 15:17:41
